Banda,Título,Letra,Link
José José,Como Le Haces (Esas Mujeres),"Esas mujeres


Tan amadas, tan amantes, tan queridas


Importantes como nada en nuestras vidas


¿Cómo le haces cuando quieres olvidarlas?


Esas mujeres


Que se adueñan de tu amor siempre a su modo


Que no piden, pero quieres darles todo


¿Cómo le haces cuando quieres olvidarlas?


Son amores, son pasiones que sentimos


Son locuras y aventuras que vivimos


Son la risa, son el llanto y el dolor


Esas mujeres


Esas mujeres


Son las flores del jardín que da la vida


Con colores, con perfume, con espinas


Con lo dulce o con lo amargo en cada esquina


Esas mujeres


Con lo bueno y con lo malo en nuestra historia


Que no salen que están siempre en la memoria


¿Cómo le haces cuando quieres olvidarlas?


Son amores, son pasiones que sentimos


Son locuras y aventuras que vivimos


Son la risa, son el llanto y el dolor


Esas mujeres


Esas mujeres


Son las flores del jardín que da la vida


Con colores, con perfume, con espinas


Con lo dulce o con lo amargo en cada esquina


Esas mujeres


Con lo bueno y con lo malo en nuestra historia


Que no salen que están siempre en la memoria


¿Cómo le haces cuando quieres olvidarlas?",https://www.letras.com//jose-jose/como-le-haces-esas-mujeres/
José José,Como Tú,"Yo miraba la vida pasar parado en la orilla


Convertida en un juego que quise y no pude parar


Me bebí tanto amor


Tantas noches de golpe y no pude


Disfrazar mi tristeza, mi pena y mi soledad


Cuántas veces sentí de verdad


Que yo estaba vencido


Caminando sin rumbo


Y andando nomás por andar


Por momentos perdí la esperanza


De estar algún día


Compartiendo mi casa


Con alguien así como tú


Como tú, soñaba alguien como tú


Alguien que de pronto cambiara


Mis sueños, mi suerte, llegaste tú


Alguien que me hiciera el amor como tú


Alguien que luchara así como tú


Igual como tú, así como tú


Como tú, quería alguien como tú


Alguien que fuera mi dueña, mi faro


Mi guía, y llegaste tú


Alguien que me hiciera vibrar como tú


Con esa ternura, así como tú


Igual como tú, así como tú


Cuando vuelven a mí


Los recuerdos de tantos domingos


Compartiendo mi cuarto con nadie


Ni nada que hablar


Me bebí tanto amor


Tantas noches de golpe y no pude


Disfrazar mi tristeza, mi pena y mi soledad


Como tú, soñaba alguien como tú


Alguien que de pronto cambiara


Mi suerte, mis sueños, llegaste tú


Alguien que hiciera el amor como tú


Alguien que luchara así como tú


Igual como tú, así como tú


Como tú, quería alguien como tú


Alguien que fuera mi dueña, mi faro


Mi guía, y llegaste tú


Alguien que me hiciera vibrar como tú


Con esa ternura, así como tú


Igual como tú, así como tú


Como tú, soñaba alguien como tú",https://www.letras.com//jose-jose/como-tu/
José José,Como Ya No Me Amas,"Como ya no me amas


Voy a irme lejos


Donde nunca alguien


Mencione tu nombre


Ni sepan quien soy


Voy a irme solo


Sin decirle a nadie


Para qué molestias


Si hasta a mis amigos


Lastima les doy


Como ya no me amas


Ahí te dejo el mundo


Para ti solita


Haz lo que tú quieras


Porque yo me voy


Ojalá me olvides


Y jamás me busques


Porque yo te juro


No darás conmigo


Desde el día de hoy


Como ya no me amas


Como yo te amo


Solo por orgullo


Como ayer mi vida


Hoy mi adiós te doy


Y ojalá no sufras


Y ojalá no llores


Porque nunca, nunca


Oye bien que nunca


Sabrás donde estoy",https://www.letras.com//jose-jose/como-ya-no-me-amas/
José José,Condenado,"Yo bebí tu manantial


Fui un perro fiel


Y sediento


Y en el mar de tu piel


Mi velero tenía un invierno


Me creí cada palabra de tu boca


Y me mentiste o estas loca


Al decirme que te vas


Me has condenado amor


Porque vivo pendiente de ti


Y ya no sé quien soy


Porque todo lo fui junto a ti


Me has condenado amor


Y estoy libre por tu voluntad


Pero preso de mi libertad


Alterado, confundido y sin razón


No comprendo


Te has burlado de mí


Y has jugado un juego siniestro


Me creí cada palabra


Me has condenado, amor",https://www.letras.com//jose-jose/condenado/
José José,Contigo En La Distancia,"No existe un momento del día


En que pueda apartarme de ti


Ya todo parece distinto


Si tu no estás junto a mí


No hay bella melodía


En que no surjas tú


Y yo puedo escucharla


Si no la escuchas tú


Es que te has convertido


En parte de mi alma


Ya nada me conforma


Si no estás tú también


Más allá de tus labios


Del Sol y las estrellas


Contigo en la distancia


Amada mía, estoy


Es que te has convertido


En parte de mi alma


Ya nada me conforma


Si no estás tú también


Más allá de tus labios


Del Sol y las estrellas


Contigo en la distancia


Amada mía, estoy",https://www.letras.com//jose-jose/135209/
José José,Contigo No,"Que duro es para mí decirte que no quiero


Que ya no puedo amarte a solas y en secreto


Porque te aprecio tanto y tanto te respeto


Créeme, que ya no puedo


Yo soy amigo de ese hombre mucho antes


Mucho antes de que él llegara a ser tu amante


Y sé que a ti te quiere mucho, más que a nadie


¿Cómo puedo yo engañarle?


¿Cómo podría después?


Mirarte a ti y hablar con él


¿Cómo podría después?


Sabiendo que le he sido infiel


No lo puedo traicionar


Contigo no lo engañaré


Yo soy su amigo leal


Contigo no, perdóname


¿Cómo podría después?


Mirarte a ti y hablar con él


¿Cómo podría después?


Sabiendo que le he sido infiel


Y ahora márchate tranquila y sin temores


Que él nunca sabrá por mí de tus errores


Yo soy amigo y compañero de ese hombre


¿Cómo puedo yo engañarle?


¿Cómo podría después?


Mirarte a ti y hablar con él


¿Cómo podría después?


Sabiendo que le he sido infiel


No lo puedo traicionar


Contigo no lo engañaré


Yo soy su amigo leal


Contigo no, perdóname


¿Cómo podría después?


Mirarte a ti y hablar con él


¿Cómo podría después?


Sabiendo que le he sido infiel


No lo puedo traicionar


Contigo no lo engañaré


Yo soy su amigo leal


Contigo no, perdóname


¿Cómo podría después?


Mirarte a ti y hablar con él


¿Cómo podría después?


Sabiendo que le he sido infiel",https://www.letras.com//jose-jose/contigo-no/
José José,Corre y Ve Con Él,"A quién quieres engañar


Si puedo leer la verdad en tus ojos


Y sé que mientes


Para qué disimular


Si estas aquí sin estar


Preocupada e indiferente


A donde quieres llegar


Si el amor es todo y más


Y el corazón, y el corazón nunca miente


Si le quieres de verdad


No pierdas tu tiempo más


Te deseo mucha suerte


Corre y ve con él, no lo dudes, mujer


A qué engañarte más si no ganas nada


Corre y ve con él, hoy me toca perder


Yo nunca me imaginé que fueras tan falsa


A quién quieres engañar


Si puedo leer la verdad en tus ojos


Y sé que mientes


Si le quieres de verdad


No pierdas tu tiempo más


Te deseo mucha suerte


Corre y ve con él, no lo dudes, mujer


A qué engañarte más si no ganas nada


Corre y ve con él, hoy me toca perder


Yo nunca me imaginé que fueras tan falsa


Corre y ve con él, no lo dudes, mujer


A qué engañarte más si no ganas nada


Corre y ve con él, hoy me toca perder",https://www.letras.com//jose-jose/corre-y-ve-con-el/
José José,Cosa de Dos,"Fui


Entendiendo tu amor por mí


Fui


Conociéndote así


Por eso me gustaste


Por eso me atrapaste


Tanto y tanto amarme así


Yo nunca había pensado


Que estando tú a mi lado


Iba a sentirme tan feliz


Nunca yo


He dejado de amarte así


Porque tú


No has dejado de amarme a mí


Yo


Nunca había conocido el amor


Yo


No sabía que era cosa de dos


Y ahora al encontrarnos


Para nunca más dejarnos


Sé bien, me vas a ser feliz


Y juntos viviremos


Y así los dos tendremos


Algo lindo porque vivir


Nunca yo


He dejado de amarte así


Porque tú


No has dejado de amarme a mí


Mi amor


Que bueno que te conocí


Porque sé


Que voy a vivir muy feliz


Nunca yo


He dejado de amarte así


Pues tu amor


Siempre ha sido solo para mí


Mi amor


Que bueno que te conocí


Porque tú


No has dejado de amarme así


Nunca más


He dejado de amarte así


Porque sé


Que voy a vivir muy feliz",https://www.letras.com//jose-jose/cosa-de-dos/
José José,Cosas Imposibles,"Tomar tus manos


Besar tu boca


Ser tu alegría


Sentirte mía


Son esas cosas imposibles


Que no fueron hechas para mí


Tocar tu pelo y ser tu anhelo


Y por las noches ser tu desvelo


Son esas cosas imposibles


Que no fueron hechas para mí


Dejaron mis besos rosas en botones


Que se marchitaron antes de brotar


Mis abrazos van camino a los ocasos


Sin podértelos dar


En un momento de un mes de mayo


Gozar la dicha de tu desmayo


Son esas cosas imposibles


Que no fueron hechas para mí


Son esas cosas imposibles


Que no fueron hechas para mí",https://www.letras.com//jose-jose/cosas-imposibles/
José José,Cruz de Olvido,"Con el atardecer


Me iré de ti


Me iré sin ti


Me alejaré de aquí


Con un dolor


Dentro de mí


Te juro, corazón


Que no es falta de amor


Pero es mejor así


Un día comprenderás


Que lo hice por tu bien


Que todo fue por ti


La barca en que me iré


Lleva una cruz de olvido


Lleva una cruz de amor


Y en esa cruz sin ti


Me moriré de hastío


Culpable no he de ser


De que por mí puedas llorar


Mejor será partir


Prefiero así que hacerte mal


Yo sé que sufriré


Mi nave cruzará


Un mar de soledad


Adiós, adiós, mi bien


Recuerda que te amé


Que siempre te he de amar


La barca en que me iré


Lleva una cruz de olvido


Lleva una cruz de amor


Y en esa cruz sin ti


Me moriré de hastío


La barca en que me iré


Lleva una cruz de olvido


Lleva una cruz de amor


Y en esa cruz sin ti


Me moriré de hastío",https://www.letras.com//jose-jose/cruz-de-olvido/
José José,Cuando El Amor Se Va de Casa (Cuando o Amor Cambia de Casa),"En frente de la puerta de la sala donde entré


Encuentro aquellas fotos que hace tres años dejé


Levanto mis ojos por las paredes de papel


Marcadas con tus dedos, como si fuese tu propio ser


El mobiliario todo tuyo en el polvo que juntó


Escribo con mis dedos tu nombre, qué pasó


En la sala una nostalgia, que se sienta en el sofá


No son pasos marcados de las ganas de quedar


Que sea así


Porque no debe ser


Que sea así


Porque no debe ser


El amor no espera


El amor no se atrasa


Una frase sencilla


El amor no termina


Cambia de casa


El amor no espera


El amor no se atrasa


Una frase sencilla


El amor no termina


Cambia de casa


El en cuarto, la ventana que se cierra para no ver


También la puerta abierta esperando por ti


Un disco muy antiguo se oye en nuestro corredor


El vidrio de perfume que nació ya se acabó


La luz que me espiaba para clarear el cuarto entero


Se pierde lentamente frente a la puerta del baño


Que blanco el azulejo, es fría la casa tan solita


El tiempo va quemando mi existencia en la cocina


Que sea así


Porque no debe ser


Que sea así


Porque no debe ser


El amor no espera


El amor no se atrasa


Una frase sencilla


El amor no termina


Cambia de casa


El amor no espera


El amor no se atrasa


Una frase sencilla


El amor no termina


Cambia de casa",https://www.letras.com//jose-jose/747481/
José José,Cuando Tu Me Quieras,"Noche a noche sueño contigo siento


Tu vida en la mía


Cuál sombra divina, cuál eco distante


Que apenas puedo oír


Cuando tú me quieras


Cuando te Vea sonreír


Vibrarán las campanas


Y alegres mariposas


Lucirán sus colores


En un suave vaivén


Cuando tú me quieras


Cuando me digas que sí


Robaré las estrellas para ofrecerte un día


Y rendirme a tus pies


Subirán por tu balcón las flores que


En rubor


Reflejarán el brillo


El brillo de tus ojos cuando tú me quieras


Cuando tú me quieras


Cuando me digas que sí


Robaré las estrellas para ofrecerte un día


Y rendirme a tus pies


Subirán por tu balcón las flores que


En rubor reflejarán el brillo


El brillo de tus ojos cuando tú me quieras


Cuando tú me quieras


Cuando me digas que sí


Robaré las estrellas para ofrecerte un día


Y rendirme a tus pies",https://www.letras.com//jose-jose/cuando-tu-me-quieras/
José José,Cuando Un Amor Se Muere,"Al igual que una flor se marchita


Porque ya no le queda fragancia


Nuestro amor se nos fue deshojando


Arrancándole aroma salada


El amor yo no sé por qué muere


Pero el nuestro murió antes de tiempo


Y aunque quedan caricias y besos


Y no sé ni lo qué hacer con ello


Cuando un amor se muere queda la vida


Con un sabor amargo de despedida


Y seguimos andando, mirando al suelo


Porque ya no sabemos mirar al cielo


Cuando un amor se muere queda la vida


Con un sabor amargo de despedida


Y seguimos andando, mirando al suelo


Porque ya no sabemos mirar al cielo


Nuestro amor se murió poco a poco


Como enfermo de un mal incurable


Derrotándose a veces la causa


Y sintiéndose a veces culpable


¿Para qué remover las cenizas?


Y buscar al por qué las razones


Cuando muere un amor más te quema


Y no sirven las explicaciones


Cuando un amor se muere queda la vida


Con un sabor amargo de despedida


Y seguimos andando, mirando al suelo


Porque ya no sabemos mirar al cielo


Cuando un amor se muere queda la vida


Con un sabor amargo de despedida


Y seguimos andando, mirando al suelo


Porque ya no sabemos mirar al cielo",https://www.letras.com//jose-jose/cuando-un-amor-se-muere/
José José,Cuando Vayas Conmigo,"Cuando vayas conmigo no mires a nadie


Que tú sabes que yo no consiento un desaire


Que me sienta muy mal, que tú vuelvas la cara


Cuando tienes al lado a quien tanto te ama


Cuando vayas conmigo no mires a nadie


Que alborotas los celos que tengo del aire


Que me sienta fatal cuando alguien que pasa


Por un solo momento distrae tu mirada


Cuando vayas conmigo


Ve apoyada en mi hombro


Escuchando el latido que lleva


Mi sangre tan solo


Cuando vayas conmigo


Nada debe importarte


Que tu mundo se encierre


En tu amor y mi amor


Cuando vayas conmigo


Cuando vayas conmigo no mires a nadie


Que tú sabes que yo no consiento un desaire


Que me sienta muy mal, que tú vuelvas la cara


Cuando tienes al lado a quien tanto te ama


Cuando vayas conmigo no mires a nadie


Que alborotas los celos que tengo del aire


Que me sienta fatal cuando alguien que pasa


Por un solo momento distrae tu mirada


Cuando vayas conmigo


Ve apoyada en mi hombro


Escuchando el latido que lleva


Mi sangre tan solo


Cuando vayas conmigo


Nada debe importarte


Que tu mundo se encierre


En tu amor y mi amor


Cuando vayas conmigo


Cuando vayas conmigo


Ve apoyada en mi hombro


Escuchando el latido que lleva


Mi sangre tan solo",https://www.letras.com//jose-jose/135210/
José José,Cuidado,"Cuidado, mucho cuidado


Que estás tomando


Por un rumbo equivocado


Cuidado con tus mentiras


Que yo las puedo adivinar


Cuando me miras


Cuidado, mucho cuidado


Que estoy de vuelta


Cuando tú ni has comenzado


Cuidado, no estoy tan ciego


Para dejarte continuar


Con este juego


Cuidado


Cuando me tengas que dejar


A un lado


Piensa que el mundo seguirá


Girando


Y alguna vez acabarás llorando


Cuidado


Porque a tu vida me tendrás


Ligado


Porque en tu mente yo estaré


Presente


Porque al volver inclinarás la frente


Cuidado


Cuando me tengas que dejar


A un lado


Piensa que el mundo seguirá


Girando


Y alguna vez acabarás llorando


Cuidado


Porque a tu vida me tendrás


Ligado


Porque en tu mente yo estaré


Presente


Porque al volver inclinarás la frente",https://www.letras.com//jose-jose/135211/
José José,De Hombre a Hombre,"Créeme


Si yo pudiera tenerla


Como la puedes tener


No dudaría jamás, lucha por ella


Créeme


Si te preocupa que un día


Fuimos amantes, quizás


Eso olvídalo ya, son tonterías


De hombre a hombre


Tómala tal como es


Puedes llenarla de amor


No tendrás quejas


De hombre a hombre


No te la dejes quitar


Ámala y hazla feliz


Vale la pena


Créeme


Si yo pudiera tenerla


Como la puedes tener


No dudaría jamás, lucha por ella


Créeme


Si te preocupa que un día


Fuimos amantes, quizás


Eso olvídalo ya, son tonterías


De hombre a hombre


Tómala tal como es


Puedes llenarla de amor


No tendrás quejas


De hombre a hombre


No te la dejes quitar


Ámala y hazla feliz


Vale la pena


De hombre a hombre


Tómala tal como es


Puedes llenarla de amor


No tendrás quejas


De hombre a hombre


No te la dejes quitar


Ámala y hazla feliz


Vale la pena


De hombre a hombre


Tómala tal como es


Puedes llenarla de amor


No tendrás quejas",https://www.letras.com//jose-jose/de-hombre-a-hombre/
José José,De Pueblo En Pueblo,"Vagaba solo de pueblo en pueblo


Sin un cariño, yo no sabía


Lo que era un beso, lo que era amor


Cantando siempre con mi guitarra


Crucé montañas, valles y ríos


Era dichoso con mi canción


Más de repente tu te cruzaste


Por mi camino, mil emociones


Desconocidas yo descubrí


Paré mi marcha y entre tus brazos


Hice mi nido porque creí


Que me entregabas todo de ti


Pero mi dicha fue pasajera


Porque me diste desilusión


Mientras te daba mi vida entera


Tú destrozabas mi corazón


Y por eso digo ahora


Que el amor es dolor, ya no


Canto, ya no rio, ni me alumbra


Más el Sol, mi canción quedó


En silencio, mi guitarra en un rincón


Extrañando mi vagar de trovador


Pero ahora mismo vuelvo a


Mi vida de peregrino, y haré


De cuenta que eres la gente


Que nunca vi, agarro el paso


Sin detenerme mirando al frente


Para seguir cantando siempre


Cantando así


La la y la la y a la y la


Agarro el paso


Sin detenerme mirando al frente


Para seguir cantando siempre


Cantando así


La la y la la y a la y la


Agarro el paso


Sin detenerme mirando al frente


Para seguir cantando siempre


Cantando así


La la y la la y a la y la


Agarro el paso


Sin detenerme mirando al frente


Para seguir cantando siempre


Cantando así


La la y la la y a la y la",https://www.letras.com//jose-jose/135212/
José José,Déjame Conocerte (Let Me Get To Know You),"Deja conocerte


Déjame soñar


Vivir un momento


De felicidad


Déjame besarte


Con todo este amor


Quiero conocerte


Sentir tu calor


Ven, ven amor


Ven, ven a mí


Seremos muy felices


Tú de mí y yo de ti


Amar es muy fácil


A alguien como tú


Piel con piel unidos


Soñando los dos


Mirando la lluvia


Del cielo al caer


Pensando que el mundo


Solo nuestro es


Ven, ven amor


Ven, ven a mí


Seremos muy felices


Tú de mí y yo de ti


Ven, ven amor


Ven, ven a mí


Seremos muy felices


Tú de mí y yo de ti


Ven, ven amor


Ven, ven a mí


Seremos muy felices


Tú de mí y yo de ti",https://www.letras.com//jose-jose/dejame-conocerte/
José José,Del Altar a La Tumba,"Te dije que te extraño


Te dije que te quiero


Y que me gusta mucho


El color de tu pelo


Te dije que tu vida y mi vida se juntan


Que siempre seré tuyo, del altar a la tumba


Te dije que te extraño


Te dije que te quiero


Lo que en verdad es blanco


Sin ti, parece negro


Te dije que tu alma


Y mi vida se buscan


Que siempre seré tuyo


Del altar a la tumba


Te dije que te extraño


Te dije que te quiero


Y que me gusta mucho


El color de tu pelo


Te dije que tu vida y mi vida se juntan


Que siempre seré tuyo, del altar a la tumba


Te dije que te extraño


Te dije que te quiero


Lo que en verdad es blanco


Sin ti, parece negro


Te dije que tu alma


Y mi vida se buscan


Que siempre seré tuyo


Del altar a la tumba


Te dije que te extraño


Te dije que te quiero


Lo que en verdad es blanco


Sin ti, parece negro


Te dije que tu alma


Y mi vida se buscan


Que siempre seré tuyo


Del altar a la tumba


Del altar a la tumba",https://www.letras.com//jose-jose/1860887/
José José,Desesperado,"Vuelve


Por favor, cómo estés, cómo sea


Que a nadie le importa


Aunque te hayas manchado de todo


Para mí es igual


No me importa lo que seas


No me importa si has cambiado


No me importa si eres otra


No me importa si has pecado


Vuelve, te lo ruego, porque estoy


Desesperado


Decidido a aceptar lo que sea


Tú has ganado


Ya lo ves que sin ti soy un hombre acabado


Sin ganas de vivir


Desesperado


Necesito tu cuerpo caliente a mi lado


Para darme esa fuerza


Que solo tú me has dado


Ten piedad de mí


Vuelve


Aunque vengas de Dios sabe dónde


Aquí está tu casa


Aunque te hallan tocado mil manos


Para mí es igual


No me importa lo que digan


No me importa lo que has dado


No me importa si estás limpia


No me importa lo pasado


Vuelve, te lo imploro, porque estoy


Desesperado


Decidido a aceptar lo que sea


Tú has ganado


Ya lo ves que sin ti soy un hombre acabado


Sin ganas de vivir


Desesperado


Necesito tu cuerpo caliente a mi lado


Para darme esa fuerza


Que solo tú me has dado


Ten piedad de mí


Desesperado


Decidido a aceptar lo que sea


Tú has ganado


Ya lo ves que sin ti soy un hombre acabado


Sin ganas de vivir


Desesperado


Necesito tu cuerpo caliente a mi lado


Para darme esa fuerza


Que solo tú me has dado


Ten piedad de mí",https://www.letras.com//jose-jose/747482/
José José,Disimula,"Disimula


Que la gente nos mira


Un pequeño descuido


Y todo se acabó


Disimula


Fingiendo que te aburres


Y piensa en mis caricias


Nuestras tardes de amor


Disimula


Haz como si no pasara nada


Bésame en tu mente, pero amor


No te arriesgues nada


Disimula


Cuida de no hacer una locura


Déjate llevar y ten valor


Amor mío, por favor


Disimula


Y no busques mis ojos


Que una simple mirada


No puedes traicionar


Disimula


Ni te acerques siquiera


Permanece a su lado


Y actúa natural",https://www.letras.com//jose-jose/747483/
José José,Divina Ilusión,"Divina ilusión que yo forjé


Un sueño fue que no se realizó


Sin tu calor, mi alma morirá


Pensando siempre en ti


Dulce amor, ver a mí


Recuerda, mi bien


Lo que tú y yo soñamos


Siempre para nuestro amor


No puedo más


Siento que mi alma se desgarra


Pues le faltan las caricias


Y los besos de tu amor


Ven, dulce bien, dame la ilusión


De saber que al fin de mí serás


Divina ilusión que yo forjé


Un sueño fue que no se realizó


No puedo más


Siento que mi alma se desgarra


Pues le faltan las caricias


Y los besos de tu amor


Ven, dulce bien, dame la ilusión


De saber que al fin de mí serás


Solo de mí, mi único amor",https://www.letras.com//jose-jose/divina-ilusion/
José José,donde andarás,"Voy a dejarte me dijiste aquella noche


Voy a olvidarte o me vas a enloquecer


Vivir contigo a tu manera es imposible


Es tan difícil que me voy queriéndote


Y fui yo mismo el que esa noche abrió la puerta


Sin darme cuenta de que no ibas a volver


Y éste tonto orgullo mío fue el culpable


De ese mal irreparable que me hice sin saber


Ando triste con la vida destruido


La alegría se me ha ido


Porque no te he vuelto a ver


Dónde andarás amor, dónde andarás amor


Te extraño tanto necesito tu querer


Dónde andarás amor, dónde andarás amor


Si perdonarás y pensarás en volver


Y fui yo mismo el que esa noche abrió la puerta


Sin darme cuenta de que no ibas a volver


Y éste tonto orgullo mío fue el culpable


De ese mal irreparable que me hice sin saber


Ando triste con la vida destruido


La alegría se me ha ido


Porque no te he vuelto a ver


Dónde andarás amor, dónde andarás amor


Te extraño tanto necesito tu querer


Dónde andarás amor, dónde andarás amor


Si perdonarás y pensarás en volver


Dónde andarás amor, dónde andarás amor


Te extraño tanto necesito tu querer


Dónde andarás amor, dónde andarás amor


Si perdonarás y pensarás en volver


Dónde andarás amor, dónde andarás amor


Te extraño tanto necesito tu querer",https://www.letras.com//jose-jose/donde-andaras/
José José,Dónde Vas,"Dices que me amas


Y no puedo entender


La forma de entregarte


A quien te da todo su ser


Dices que no tienes


Secretos para mí


Pero sueñas en voz alta


Y tengo dudas que sea así


Dónde vas, dónde vas


Cuando llegas tarde


Dónde vas, dónde vas


Los celos me queman la sangre


Ábreme tu corazón


Dónde vas, dónde vas


Mi cielo se cubre de nubes


Dónde vas, dónde vas


Por qué la mirada rehuyes


Ábreme tu corazón


Cuando decidimos


Ser amantes y pareja


Dejamos bien claro


Que nunca entre nosotros


Habría rejas


Es mejor hablar


Que esconder un sentimiento


Es mejor decir a tiempo


Perdóname amor, lo siento


Dónde vas, dónde vas


Cuando llegas tarde


Dónde vas, dónde vas


Los celos me queman la sangre


Ábreme tu corazón


Dónde vas, dónde vas


Mi cielo se cubre de nubes


Dónde vas, dónde vas


Por qué la mirada rehuyes


Ábreme tu corazón",https://www.letras.com//jose-jose/donde-vas/
