Banda,Título,Letra,Link
Bad Bunny,SEDA (part. Bryant Myers),"(Sí, te escuché)


(Lanalizer got the fire)


(Bryant Myers)


(El Millo Gánster)


(Dímelo, Conejo)


Te tengo sometida debajo de la seda


Me gustan tus medida', como ese totito me queda


Y está cabrón, ey, porque ayer le di


El jueves le di, el viernes le di


El sábado repetí


El domingo después de la iglesia la puse de rodi'


Ya no es una bebé, pero en la noche me pide bi-bi


Se la traga como Kirby, yeah


Porque la enchuló mi bi, la enchuló mi bi


Desde que lo metí (desde que lo metí)


La tengo sometida a mis nueve inch, yeah, yeah


Te tengo sometida debajo de la seda


Hace rato quería que esto suceda'


Que te muerda, te escupa y te agreda


Que mate el deseo, no que lo conceda


Salimo' de Láctea y llegamo Andrómeda


A moverte enrolando en pantie' y mi franela


Tú ere' otra movie, ese flow es novela


Blanquita, te dejo canela cuando te someto a mi lujureo


Es de la isla, su encanto, lo aventureo


Lo jalo con nuestro' video', ya ni las porno googleo, no


No veo un culo que me guste más cabrón por más Reels que swipeo


Y lo que me corre más es que me da esa chapa sin chapeo


Porque la enchuló mi bi, la enchuló mi bi


Desde que lo metí (desde que lo metí)


La tengo sometida a mis nueve inch, yeah, yeah


Te tengo sometida debajo de la se-


Dándote hasta que derrita la vela


Viene a dormir y se desvela, ey


Con esa mamá creo que mi mai tiene nueva nuera


El bill del agua viniendo trepa'o


Por to' los polvo' que echamo' en la regadera


Te toco to' los punto de tu cuerpo como si jugara Twister


Te prefiero sin ropa y eso que me encanta como te viste'


Yo lo dejo adentro, no quiero sacarlo, puede que te encinte


Despué' de chingar, prendemo' un blunt y te pongo la refe del remix de Triste


Ey, quiere chingarme hoy, yo sé


Me dio una pista que quería a cape


Empecé a orar y no terminó en amén


Me la pidió aden, adentro, aden (aden, yeah)


El trapero de trapero' con el Conejo Malo


Yeah-yeah-yeah-yeah


Pa' que las cuqui' trapeen


El Millo Gánster club


Dime, Búho


Búho


(Dime, Lanalizer) Bryant Myers


Dime, Gaby Music, Chris Jedi


(La Paciencia) Bad Bunny, baby


Porque la enchuló mi bi, 'chuló mi bi


Desde que lo metí, que lo metí


La tengo sometida a mis nueve inch


Eh-eh, eh-eh, eh-eh, eh


Porque la enchuló mi bi, 'chuló mi bi


Desde que lo metí, que lo metí",https://www.letras.com//bad-bunny/seda-part-bryant-myers/
Bad Bunny,Sensualidad (part. Prince Royce y J Balvin),"Trap Kincz, bebé


Yeah, ya, ya, ya, ya


(Ooh, oh-oh)


[Prince Royce]


Ay, baby, tu sensualidad (woa-oh-oh-oh-oh-oh)


Me tiene al borde de la locura


Y esto no es casualidad (woa-oh-oh-oh-oh-oh)


Te beso y sube la temperatura


Ay, baby, tu sensualidad (woa-oh-oh-oh-oh-oh)


Me tiene al borde de la locura


Y esto no es casualidad (woa-oh-oh-oh-oh-oh)


Te beso y sube la temperatura


[Bad Bunny]


Baby, donde tú quieras yo paso a buscarte


Tú espérame afuera, pa' así no llamarte


No traigas paraguas, como quiera va' mojarte


La temperatura está pa' calentarte


[J Balvin]


Baby, donde tú quieras yo paso a buscarte


Tú espérame afuera, pa' así no llamarte


No traigas paraguas, como quiera va' mojarte


La temperatura está pa' calentarte


[Bad Bunny]


Hay muchos tras de ti, pero yo siempre gano


La baby está dura y sin el cirujano


Vístete que hoy te voy a buscar temprano


Quiero que to' nos vean agarrados de mano


El traje que te compré


Dale póntelo, llegamos después de las tres


Yo no sé si tú mañana me vas a querer


O si después de hoy te vas a perder


Si no tú me escribes, yo te busco en el Lamborghi'


Un diablo, un beso de emoji


Yo no sé si tú mañana me vas a querer


O si después de hoy te vas a perder


[Prince Royce]


Cuando estás en mi habitación, tú sientes conmigo


Como si se paralizara el tiempo


Ya es que mi intención es estar contigo


Y hacerlo hasta dejarte sin aliento


Cuando estás en mi habitación, tú sientes conmigo


Como si se paralizara el tiempo


Ya es que mi intención es estar contigo


Y hacerlo hasta dejarte sin aliento


[J Balvin]


Baby, donde tú quieras yo paso a buscarte


Tú espérame afuera, pa' así no llamarte


No traigas paraguas, como quiera va' mojarte


La temperatura está pa' calentarte


[Bad Bunny]


Baby, donde tú quieras yo paso a buscarte


Tú espérame afuera, pa' así no llamarte


No traigas paraguas, como quiera va' mojarte


La temperatura está pa' calentarte


[J Balvin]


Yeah


La noche llama, ya me activé


Te sirvo un trago, Buchanan's, yeh


Me siento en Victoria, porque ella es un ángel


Como Selena y The Weeknd, como Shakira y Piqué


Con su hoodie de BAPE, siempre ando en backstage


En Francia ya la conocen, compremos todo Chanel


Ea, porque ella es mi jeva


No me la toquen, porque ella es una fiera


Ia-ie (ia-ie), ia-ie (ia-ie)


Ella es tan bella, tal como la imaginé


Ia-ie (ia-ie), ia-ie (ia-ie)


Es mi baby, solo yo la puedo tener


[Prince Royce]


Ay, baby, tu sensualidad (woa-oh-oh-oh-oh-oh)


Me tiene al borde de la locura


Y esto no es casualidad (woa-oh-oh-oh-oh-oh)


Te beso y sube la temperatura


[J Balvin]


Ay, baby, tu sensualidad (woa-oh-oh-oh-oh-oh)


Me tiene al borde de la locura


Y esto no es casualidad (woa-oh-oh-oh-oh-oh)


Te beso y sube la temperatura


[Bad Bunny]


Baby, donde tú quieras yo paso a buscarte


Tú espérame afuera, pa' así no llamarte


No traigas paraguas, como quiera va' mojarte


La temperatura está pa' calentarte


Bad Bunny, baby


Hear this music (leggo', leggo')


Prince Royce


J Balvin


Infinity Music


DJ Luian (¡díselo, Luian!)


Mambo Kingz


Trap Kingz, bebé


Hear this music


Tiempo de Balvin (leggo', leggo')


¡Dímelo, Braza!",https://www.letras.com//bad-bunny/sensualidad/
Bad Bunny,Ser Bichote,"Eh, eh, eh, eh, eh


Yo siempre quise ser bichote


Yo siempre quise ser bichote (yeah)


Yo siempre quise ser bichote (uh)


Y ahora somo bichotes, eh


Yo siempre quise ser bichote (ey)


Yo siempre quise ser bichote (ey)


Yo siempre quise ser bichote (yeah)


Y ahora somos bichotes


Mami quería que yo fuera un ingeniero


Papi quería un pelotero


Mi maestra de segundo


Me dijo que fuera bombero


Na, yo ya voy a hacer lo que yo quiero


Siempre quise to’a las tenis, to’a las gorras (uh)


El Pitbull, la BM, la cotorra


El Polaris, deja que el nene lo corra


Un tatuaje no se borra


Siempre me gustó la bregadera


Siempre me gustó la jodedera, ey


Pero entendí que esa no era (uh, uh, uh)


Y ahora somo’ millo’ y sin disquera


Ferrari y Lambo, Panamera


Si quiero compro el que yo quiera (uh), ey


Haciendo chavo’ a mi manera


Mi respeto a todos en la nevera, yeah, eh


Yo siempre quise ser bichote


Yo siempre quise ser bichote


Yo siempre quise ser bichote, yeah, eh, yeah


Yo siempre quise ser bichote (ey)


Yo siempre quise ser bichote


Yo siempre quise ser bichote (uh)


Y ahora somos bichotes


Cómo que qué me pasó a mí papi


Que yo mando aquí en el caserío


Y yo digo que te tienes que ir pa’l carajo


Tírala


Aquí to’ el mundo es calle (eh)


Por dentro siempre voy a ser caco


Donde quiera soy un naco (eh, eh, eh)


De chamaquito yo capeaba como polaco


Por eso tengo un flow bellaco (uh, uh, uh)


To’ los que me critican, que se mueran juntos


Chorro ‘e hijo ‘e puta, resuelvan sus asuntos


Se cierran escuelas, mientras se abren puntos


Entonces, qué hago, dime te pregunto, eh


Si siempre quise ser bichote


Yo siempre quise ser bichote


Yo siempre quise ser bichote (uh)


Y ahora somos bichotes


Yeah, yeah, yeah, yeah


Bad Bunny baby


Ba', Ba', Ba'


Yeah, eh


Ez, Ez


Ez on the, the beat",https://www.letras.com//bad-bunny/ser-bichote/
Bad Bunny,Sexto Sentido (part. Gigolo y La Exse),"Gigolo y La Exce


En busca de caricias muertas


Y algunas esperanzas rotas


Me enrede entre sus entrepiernas


Y así besando su boca


Fui culpable sin pensarlo


Un trago dulce amargo


Solo quiero hablarte claro


Tengo que confesarte


Anoche me acosté con otra


Tu sexto sentido no se equivoca


Siempre me pilla cuando le miento


No fue intencional baby lo siento


Anoche me acosté con otra


Desperté en otra cama sin ropa


Sexo y drogas toa' las noche loca


Tu sexto sentido no se equivoca


Bad Bunny baby yeh


Esta cabrón que yo a ti te la pegue


Por más bien que tú bregue


Por más que me cocina y fregue


No te acuesta hasta que llegue


Y yo con una p*** to’ los Jueves


Yeh eh eh


Otra vez me equivoque


Te juro que me sentí sucio cuando a otra yo toque


Yo no sé ni porque


Ella fue la que vino donde mí yo no la provoque


Si te quieres ir yo lo voy a entender


Tienes mil razones para no volver


Me da miedo no volverte a ver


Pero es lo que merezco por infiel


Yeh eh eh


Otra vez me equivoque


Te juro que me sentí sucio cuando a otra yo toque


Yo no sé ni porque


Ella fue la que vino donde mí yo no la provoque


Anoche me acosté con otra


Desperté en una cama sin ropa


Sexo y drogas una noche loca


Tu sexto sentido no se equivoca


Anoche me acosté con otra


Desperté en otra cama sin ropa


Sexo y drogas son las noche loca


Tu sexto sentido no se equivoca


La Exce


Anoche me acosté con otra (Yeh)


Amanecimo’ en un hotel


Me guayé con una baby bien durota


Tú no vas a entender


Porque tú eres mujer


Tú sabes ya la movie que están a 2 por 3


No quiero justificarme


Tú eres otra cosa aparte


Contigo no me protejo pero siempre voy a cuidarte


Después de la nota que cogimos


Tengo que confesarte


Anoche me acosté con otra


Tu sexto sentido no se equivoca


Y siempre me pilla cuando le miento


No fue intencional baby lo siento


Anoche me acosté con otra


Desperté en otra cama sin ropa


Sexo y drogas son las noche loca


Tu sexto sentido no se equivoca


Yeh yeh yeh yeh


Bad Bunny baby bebé


Gigolo y La Exce


Hear This Music


Díselo Luian


Mambo Kingz


Mambo Kingz


Flow Factory


Uh


A mi",https://www.letras.com//bad-bunny/sexto-sentido/
Bad Bunny,SI ELLA SALE,"Yeh-yeh, yeh-yeh, yeh-yeh


La calle está apagá', pero ella la va a prender


Porque si ella sale (sale, sale)


Todas las amigas salen


En la disco, muy duras, no son normales (no, no)


Una es callá', la otra está bien loca, ey


Pastilla y se besan en la boca


Si ella sale (sale, sale)


Todas las amigas salen


En la disco, muy duras, no son normales (no, no, no, no)


Una es callá', la otra está bien loca, ey


Pastilla y se besan en la boca


Y si ella sale (ella sale, sale, sale), ey


Todas las amigas salen (ey, ey, ey)


Comentarios de envidiosas no le valen (nah)


No le gustan psycho ni que la acorralen (no)


Uy, qué sofoquen


Mejor no la provoquen (no)


Que se calla el que la toque


A ley de na' pa' que se aloque


Baby, ese bumper aguanta el choque


Me gustan naturales


Pero no se ve mal lo que se hizo


Pa' darle, tengo permiso


Le metí en el 37, heh


Se escucha hasta en el primer piso


(Benito, ven y bájatelo de nuevo)


Dale, yo te aviso, eh


La nena tiene poder


Tranquilita, pero de nadie se deja joder (no, no)


No se deja ver


La calle está apagá', pero ella la va a prender


Porque si ella sale (sale, sale)


Todas las amigas salen


En la disco, muy duras, no son normales (no, no)


Una es callá', la otra está bien loca, ey


Pastilla y se besan en la boca


Si ella sale (sale, sale)


Todas las amigas salen


En la disco, muy duras, no son normales (no, no, no, no)


Una es callá', la otra está bien loca, ey


Pastilla y se besan en la boca",https://www.letras.com//bad-bunny/si-ella-sale/
Bad Bunny,Si Estuviésemos Juntos,"Yeh, yeh, yeh, yeh, yeh


Yeh, yeh, yeh, yeh


Yeh, yeh, yeh, yeh, yeh


Yeh


No sé si tu boca está besando a otra


En estos momentos


En estos momentos


Y no sé, si tus ojos ya se olvidaron de mí


Y los pensamientos


Se fueron con el tiempo


Y me pregunto


Qué hubiera pasado


Si estuviésemos juntos


Aún enamorados


Y me pregunto


Qué hubiera pasado


Si estuviésemos juntos


Aún enamorados


Yeh yeh


Todavía yo te espero


Aunque yo sé que tú no vas a volver


Todavía yo te quiero


Aunque yo sé que eso me puede joder


Y tengo tu foto guarda’


Tú y yo bailando cuando éramo’ menore’ de edad


Te digo la verda’


Te extraño el 14, y en la Navidad


Y lo’ polvo’ en la parte posterior


Del carro pa’ los tiempo’ en la superior


Siempre dejaba ropa interior


Cada polvo mejor que el anterior


Pero no como el primero


Tú sabe’ que ese no se va a borrar


Ahora me paso en el putero, yeh


A otra persona no he podido amar


Y te juro que lo he tratado


Pero es que ninguna se te para al lao’


Desde que te fuiste sigo trastornao’


Escuchando Masterpiece, baby me siento down


Si no tengo de tu piel, down


Deuces de Ñengo y De La, no la de Chris Brown


El cerebro dando vuelta’ lo tengo mareao’


Cada cual por su lao’, yeh eh


Y me pregunto


Qué hubiera pasado


Si estuviésemos juntos


Aún enamorados


Y me pregunto


Qué hubiera pasado


Si estuviésemos juntos


Aún enamorados


Yeh",https://www.letras.com//bad-bunny/si-estuviesemos-juntos/
Bad Bunny,"Si Tu Lo Dejas (part. Rvssian, Farruko, Nicky Jam y King Kosa)","Yeh


(Hey Rvssian)


[Bad Bunny, Nicky Jam]


Pero yo estoy con ella y tú estás con él


Sabiendo que yo siempre te voy a querer


Si tú lo dejas, yo la dejo, yeh


Si tú lo dejas, yo la dejo


Pero yo estoy con ella y tú estás con él


Sabiendo que yo siempre te voy a querer


Si tú lo dejas, yo la dejo, yeh


Si tú lo dejas, yo la dejo


[Farruko]


(Farru)


Si tú lo sabes porque tengo una baby


Si tú me haces lo mismo entonces, ¿Por qué yo no puedo?


Si tú lo dejas a él entonces yo a ella la dejo


Lo que es igual no es pecado y entonces voa' perder yo


Yo el más pendejo, que bonito te quedó


Eso que tú quieres mami tiene que salir pero de los dos


No todo depende de mí, también depende de ti


Cuando tú estés ready, lista ya pa' dar el paso


Tú me llamas y yo también lo doy


[Bad Bunny, Nicky Jam]


Pero yo estoy con ella y tú estás con él


Sabiendo que yo siempre te voy a querer


Si tú lo dejas, yo la dejo, yeh


Si tú lo dejas, yo la dejo


Pero yo estoy con ella y tú estás con él


Sabiendo que yo siempre te voy a querer


Si tú lo dejas, yo la dejo, yeh


Si tú lo dejas, yo la dejo


[Bad Bunny]


Yo no soy envidioso


Pero te veo con él y me pongo celoso


Dile que tú eres la que quiere, que yo nunca te acoso


Sé que lo que hacemos es peligroso


Siempre chingamos arrebatao' viendo to' borroso


Este phillie préndelo, tu novio déjalo


Y este bicho si lo paras después bajalo


Este phillie préndelo, tu novio déjalo


Tú no sabes todo lo que te haría yo


[Nicky Jam, Bad Bunny]


Pero yo estoy con ella y tú estás con él


Sabiendo que yo siempre te voy a querer


Si tú lo dejas, yo la dejo (yeh)


Si tú lo dejas, yo la dejo


Pero yo estoy con ella y tú estás con él


Sabiendo que yo siempre te voy a querer


Si tú lo dejas, yo la dejo, yeh


Si tú lo dejas, yo la dejo


(Ko$a)


[King Ko$a]


Ella quiere café negro por la mañana


She don’t mess with it she might swear I in the nana (Yeh)


Run away, tell your man you ain't coming back (yeah, coming back)


Don't believe in all these fairy tales


You want true love? What's the fun in that?


I'm just saying, baby you think I've been playing


She even know I'm running game


Head Concussion in the chain


Lemme beat it in yo' brain


Now your pussy is set, whoa


Baby go down like this Hennessy


I fuck you rough drain your energy


Baby go down like this Hennessy


I fuck you rough drain your energy


[Bad Bunny, Farruko]


Pero yo estoy con ella y tú estás con él


Sabiendo que yo siempre te voy a querer


Si tú lo dejas, yo la dejo, yeh


Si tú lo dejas, yo la dejo


Pero yo estoy con ella y tú estás con él


Sabiendo que yo siempre te voy a querer


Si tú lo dejas, yo la dejo, yeh


Si tú lo dejas, yo la dejo


Bad Bunny, Rvssian


Farru, (Rvssian), Ko$a


You Farru


Bad Bunny, baby


Farruko


(Bad Bunny, baby)


Nicky Jam


(Bad Bunny, baby)


Head Concussion


Yeh, Wup",https://www.letras.com//bad-bunny/si-tu-lo-dejas/
Bad Bunny,Si Veo a Tu Mamá,"Yeh, yeh


Todavía yo te quiero


Pero sé que es un error


Porque ya tú no me quieres


Y sin ti me va mejor


Y si veo a tu mamá (ey)


Yo le pregunto por ti


Pa' ver si ya tienes a alguien (¿uh?)


Alguien que te haga feliz


Y aquí estoy arrebata'o


Pensando en to'a las vece' que te lo metí


Pensando en to'a las vece' que estuve pa' ti


(Pa' ti, pa' ti, pa' ti)


No sé por qué diablo' me engaño (no)


Diciendo que te olvidé cuando te extraño


Solo comparto memes, ya yo no escribo nada (na')


Y no he borra'o tu foto, solo la puse privada


Maldito año nuevo y lo que me trajo, ey


Me botaron del trabajo


Por estar mirando pa' abajo


Pensando en ti, siempre cabizbajo


Me veo gordito, nada que rebajo (na')


No sé por qué la vida me ultrajo (no)


Pensando coger un atajo


Conocí a alguien, pero no sé, nunca encajo


Al menos que sea' tú (tú, tú, tú, tú)


Baby, te quiero aunque diga lo contrario


Llevo seis meses solitario, pero


Hoy salí con lo' muchacho' a beber


Y dije que, de ti, no iba a hablar (no, no, no)


Son las cinco, ya va a amanecer


Si no prenden, la voy a llamar


Hoy salí con lo' muchacho' a beber


Y dije que, de ti, no iba a hablar (no, no, no)


Son las cinco, ya va a amanecer


Si no prenden, la voy a llamar


Todavía yo te quiero (yo te quiero)


Pero sé que es un error (no se hace, no)


Porque ya tú no me quieres (no, no)


Y sin ti me va mejor (ju-ju)


Y si veo a tu mamá (mami), ey


Yo le pregunto por ti (okay)


Pa' ver si ya tienes a alguien


Alguien que te haga feliz",https://www.letras.com//bad-bunny/si-veo-a-tu-mama/
Bad Bunny,Soliá,"Llegó soliá, salió sin la' amiga'


Revelá', en el alcohol buscando una salida


De esa relación de mentira


Mami, ya vi cómo me miras


Te lo repito por si se te olvida


Envíale un mensaje que diga


Que no te deje sola


Porque puede perderte, si algún día vuelve a verte


De mi parte le dice' que no te deje sola


Porque puede perderte, si algún día vuelve a verte


Eh, eh, eh, eh


Eh, eh-eh


Oh-oh-oh-oh


Eh, eh-eh


Oh-oh-oh-oh


Eh, eh-eh


Oh-oh-oh-oh


Eh, eh-eh


Oh-oh-oh-oh


Hoy quiere bailar la noche entera, eh


Está casi soltera


No le presenta a nadie, eso le da flojera


Total, al final de la noche ella tiene lo que quiera


La Luna ya le indicó


Subió algo pa'l story, alguien se picó


Sonó su canción y se la dedicó


Dice que quiere hacerlo conmigo rico, eh


Que lo' cristale' se empañen


La nena está grande, como pa' que alguien la regañe


La noche no le dañe, eh


Que la Kardashian ya no está pa' Kanye


Han sido mucha' decepcione', eh


Mentira' de to' esto' cabrone', eh


Una vez más le fallaron


Daría una oportunida', pero se le acabaron


Llegó soliá, salió sin la' amiga'


Revelá', en el alcohol buscando una salida


De esa relación de mentira


Mami, ya vi cómo me miras


Te lo repito por si se te olvida


Envíale un mensaje que diga


Que no te deje sola


Porque puede perderte, si algún día vuelve a verte


De mi parte le dice' que no te deje sola


Porque puede perderte, si algún día vuelve a verte",https://www.letras.com//bad-bunny/solia/
Bad Bunny,"Solita (part. Ozuna, Wisin, Almighty, DJ Luian y Mambo Kingz)","[Bad Bunny]


Hoy no quiere saber del ex


Ni que ningún bobo se le pegue


Yo te la voy a hacer cómo es


Dime dónde quieres que le llegue


Yo sé que tú


Hace tiempo estás puesta pa’ mí (mí)


Envió una foto, dime que hay pa’ mí


Que yo te quiero pa’ mí, yeh


[Ozuna]


Qué te parece si me esperas sola, solita


Creo, mami, que tu cuerpo me necesita


Y hacemo’ toa’ las cosas que tú quiere’


De la manera que tú quiere’


Qué te parece si me esperas sola, solita


Creo, mami, que tu cuerpo me necesita


Y hacemo’ toa’ las cosas que tú quiere’


De la manera que tú quiere’ (¿qué te parece?)


[Almighty]


Dime si me esperas sola


¿Tienes delivery o hago la cola?


¿Voy desarmao’ o voy con la pistola?


Siempre le paso el rolo cuando escribo


Con el pasto que tú enrola’


Yo tengo el control, pero ella me controla


Me siento forever alone, celu' en modo avión


Mezclando pastillas con ron


Yo tengo una conne’ en el Bronx


Que tiene más bombas que Donald Trump, yeah


Booty grande, todo grande


Me enamora cuando me lo lambe


Yo nunca me quedo, me quedo


Estoy como Pina que tiene su Plan B


Espera en la cocina, abre la marquesina


Que quiero meterte vecina


¿Te gusta mojarte? Yo tengo piscina


¿Te gustan las retro? Las de tu jevo son chinas


Sí, china


Lo sé porque las patrocina


No era el oficial


Pero oficialmente te meto en la oficina


¡Almighty!


[Bad Bunny]


Ella es cubana y me dice: Asere


Te envié el location pa’ que ahí me espere’


To’ callao’ pa’ que tu novio no se entere (no)


‘Tá dura sin que se opere


Dice que conmigo hasta dentro del avión


Se viene y grita como Céline Dion


Una movie porno, pero sin el guión


La echo afuera pa’ que no haya embrión, yeh-yeh


Conmigo, to’ Gucci, to’ Fendi


Con tu novio ni las Puma Fenty


Que deje el fronteo, que tiene Mercedes


Si siempre lo tiene empty


Yo sé que tú no te metes con cualquiera


‘Toy puesto pa’ ti, pa’ hacer lo que tú quiera'


[Ozuna]


Qué te parece si me esperas sola, solita


Creo, mami, que tu cuerpo me necesita


Y hacemo’ toa’ las cosas que tú quiere’


De la manera que tú quiere’


Qué te parece si me esperas sola, solita


Creo, mami, que tu cuerpo me necesita


Y hacemo’ toa’ las cosas que tú quiere’


De la manera que tú quiere’ (¿qué te parece?)


Si me esperas sola, te voy a robar, mi loba


Tú con esas nalgas, de toas’ me las cobras


No me deja pasar ni una, por la baby doy mi fortuna


Si le busca el playlist en el celu', tiene tos’ los temas de Ozuna


Mía es la bebé


Trépate y házmelo como quiera


Usted me dice que yo tengo flow


Pa’ repartirle al que no le dé


Y si está sola, solita


Rápido solicita


Que yo llego en el Ferro


Pa’ comérmela completita


Sola, solita


Rápido solicita


Que yo llego en el Ferro


Pa’ comérmela completita


Sé que te gusta lo que yo tengo


Cuando me llama, rápido la atiendo (W)


[Wisin]


Baby, espérame en bata


Prepara la fogata con cara de sata (yeah)


En ropa interior se retrata


Yo tengo la compu, tú tienes la data


Nos vamos de viaje, tú eres la azafata


Ella desnuda me mata


Se calienta, se prendre, se trepa (oye)


Casi siempre me sonsaca


Baby, dame lo que quiero


Tú sabes a lo que me refiero


El hombre de acero, el vaquero


De tu cuerpo me apodero


No quiero pero, dale primero


Contigo me acelero


Baby, dale suave, dale ligero


Hazme tu prisionero


La baby sobresale (tiene los poderes)


Ella es la más que sabe (heh, hey, hey)


Se pone atrevida, se toca el pelo


Cara de mala y quiere que la grabe (yeah)


Lo quiere suave (todo lo que ella diga)


Que la luz la apague


Toda una jefa, me mira a la cara


Se pone caliente, no quiere que acabe


(Tú tienes que correr con la mía)


[Ozuna]


Qué te parece si me esperas sola, solita


Creo, mami, que tu cuerpo me necesita


Y hacemo’ toa’ las cosas que tú quiere’


De la manera que tú quiere’


Qué te parece si me esperas sola, solita


Creo, mami, que tu cuerpo me necesita


Y hacemo’ toa’ las cosas que tú quiere’


De la manera que tú quiere’ (¿qué te parece?)


[Wisin, Bad Bunny y Ozuna]


Se hizo un llamado


Hemos escogido a los mejores del mundo


W, El Conejo Malo


Ozuna, Almighty


Luian, Mambo Kingz


Hear This Music


Muchachos, sigan sumando


Nosotros seguimos multiplicando (Dímelo Vi)


Haciendo plata (Trap Kingz, bebé)


Trap Kingz",https://www.letras.com//bad-bunny/solita-part-ozuna-wisin-y-almighty/
