Banda,Título,Letra,Link
José José,40 y 20,"Mentiras, son todas mentiras


Cosas que dice la gente


Decir que este amor es prohibido


Que tengo cuarenta y tu veinte


Que yo soy otoño en tu vida


Y tú eres dulce primavera


No saben que guardo un verano


Que cuando te miro, te quema


Cuarenta y veinte


Cuarenta y veinte


Es el amor lo que importa


Y no lo que diga la gente


Cuarenta y veinte


Cuarenta y veinte


Toma mi mano, camina conmigo


Mirando de frente


No importa que a mí no me entiendan


Y que por lo bajo comenten


Que existe una gran diferencia


Que tengo cuarenta y tú veinte


Que yo tengo muchas vivencias


Y tú tienes tanta inocencia


No saben que nuestro secreto


Es tu juventud y mi experiencia


Cuarenta y veinte


Cuarenta y veinte


Es el amor lo que importa


Y no lo que diga la gente


Cuarenta y veinte


Cuarenta y veinte


Toma mi mano, camina conmigo


Mirando de frente",https://www.letras.com//jose-jose/135199/
José José,A Esa,"A esa la he querido yo a rabiar


La he querido yo a morir


Tú no puedes figurarte


Como la he podido amar


A esa que ahora está como ya ves


Destruida de rodar


Yo le he escrito mil poemas


A sus ojos y a su piel


A esa que la ves ahí dando tumbos


Con borrachos, con ilusos


Hasta el alma le entregué


A esa que hoy se enreda con cualquiera


Yo le di mi vida entera


Y hoy se la daría otra vez


A esa


A esa la he enseñado yo a besar


A sentir y a ser mujer


Y ya ves que aventajada


Quién se lo iba a suponer


A esa la he querido yo a rabiar


La he querido yo a morir


Tú no puedes figurarte


Como la he podido amar


A esa que la ves ahí dando tumbos


Con borrachos, con ilusos


Hasta el alma le entregué


A esa que hoy se enreda con cualquiera


Yo le di mi vida entera


Y hoy se la daría otra vez


A esa que la ves ahí dando tumbos


Con borrachos, con ilusos


Hasta el alma le entregué


A esa que hoy se enreda con cualquiera


Yo le di mi vida entera


Y hoy se la daría otra vez


A esa


A esa",https://www.letras.com//jose-jose/135200/
José José,A Partir de Hoy,"A partir de hoy


Tú vas por tu rumbo, yo voy por el mío


Tú tienes tus cosas, yo tengo las mías


Dejarán las cosas de ser cosas nuestras


Nos convertiremos en partes distintas


Una misma cosa, ya jamás seremos


A partir de hoy


Se olvidarán mis manos de buscarte


Me enseñaré que no debo extrañarte


Pues nuestro amor es una flor que se murió


A partir de hoy


Tú cruzas los ríos, yo surco los mares


Tú vives de día, yo muero de noche


No habrá más caricias, no habrá más reproches


Si eres hoja seca, yo soy primavera


Lo nuestro es un muerto y hay que sepultarlo


A partir de hoy


Se olvidarán mis manos de buscarte


Me enseñaré que no debo extrañarte


Pues nuestro amor es una flor que se murió


A partir de hoy


Se olvidarán mis manos de buscarte


Me enseñaré que no debo extrañarte


Pues nuestro amor es una flor que se murió


A partir de hoy


Se olvidarán mis manos de buscarte


Me enseñaré que no debo extrañarte",https://www.letras.com//jose-jose/135201/
José José,A Ratos,"A ratos


Me ofreces amor, a ratos


Te gustan las aventuras


Como a todos los novatos


A ratos


Me ofreces amor, a ratos


Pues no quieres ataduras


Ni cadenas ni contratos


Y me dices que el amor de tiempo entero


Siempre deja cicatrices


Y se olvidan, los te quiero


Y me juras que besar a todas horas


No te sabe a travesura


Si es que a diario


Te enamoras


Tú respetas


El amor que ayer te dí


Hoy mi agenda está completa


No hay ratos para ti


A ratos


Me ofreces amor, a ratos


Te gustan las aventuras


Como a todos los novatos


A ratos",https://www.letras.com//jose-jose/135202/
José José,A Un Amigo,"Ay, amigo


Cómo duele perder


Cómo duele perder


Lo que he tenido


Ay, amigo


Solo a ti de verdad


Yo te puedo decir


Lo que he sufrido


Siempre encuentro en ti


Paz en mi sufrir


Puedo en ti confiar


Y jamás dudar


Que me fallarás


Como los demás


Por ser mi amigo


Te bendigo


Por estar junto a mí


Por creer que jamás


Seré un perdido


Sé conmigo


Hoy que al verme sufrir


Me han volteado la cara


Y se han ido


Te puedo jurar


Si en mi caminar


Te vuelvo a encontrar


Por la vida sin fe


Ni alegría


Lucharé por no


Verte caído


Pues yo soy tu amigo


Te bendigo


Por estar junto a mí


Por creer que jamás


Seré un perdido


Sé conmigo


Hoy que al verme sufrir


Me han volteado la cara


Y se han ido


Te puedo jurar


Si en mi caminar


Te vuelvo a encontrar


Por la vida sin fe


Ni alegría


Lucharé por no


Verte caído


Pues yo soy


Tu amigo",https://www.letras.com//jose-jose/a-un-amigo/
José José,"Adiós, Princesa","Jamás te he visto tan bella, te lo juro


Cuánta gente hay, amor, estás feliz


Comprendo que te olvidaras de invitarme


Qué ironía, tú de novia, yo sin ti


Tendré que aprender a estar sin muchas cosas


Sin tus besos, sin tu risa, sin tu amor


Sin tu cuerpo, como potro desbocado


Galopando, tantas noches de amor


Adiós, adiós, princesa


Espero que hayas hecho lo mejor


Y tengas lo que yo te he dado tanto


Amor, amor y amor


Adiós, adiós, princesa


Que el mundo entero gire para ti


Espero que no tengas que acordarte


Jamás, jamás de mí


Jamás me gustaste tanto, te lo juro


Qué gran triunfo hay en tus ojos, se te ve


Qué lástima no poder felicitarte


Qué dirías y de blanco hay que ver


Seguro que cuando llegue el gran momento


Cuando te hagan la pregunta y digas sí


Será como si jamás me hubieras visto


Ay, amiga, esto es ver para vivir


Adiós, adiós, princesa


Espero que hayas hecho lo mejor


Y tengas lo que yo te he dado tanto


Amor, amor y amor


Adiós, adiós, princesa


Que el mundo entero gire para ti


Espero que no tengas que acordarte


Jamás, jamás de mí",https://www.letras.com//jose-jose/747476/
José José,Agua Con Sal,"Cuando una gota de lluvia por tu carita rodó


Yo dije llora, llora, llora por mí


Llora por mí


Y me sentí tan alegre porque llorabas por mí


Qué dije me ama, me ama y no era así


Era agua nada más que una nube lloró


Luego tu cara y la mía la lluvia mojó


Pero después yo te dije, estoy seguro que tú


Ya no me quieres, nada mejor adiós


Y en tus mejillas vi dos gotas que bebí


Y no era lluvia, eran gotas del alma con sal


Nunca un sabor más precioso a mi boca llegó


Nunca creí que el amor era agua con sal


Nunca creí que el amor era agua con sal


Nunca creí que el amor era agua con sal


Nunca creí que el amor era agua con sal


Ya no me quieres, nada mejor adiós


Y en tus mejillas vi dos gotas que bebí


Y no era lluvia, eran gotas del alma con sal


Nunca un sabor más precioso a mi boca llegó


Nunca creí que el amor era agua con sal


Nunca creí que el amor era agua con sal


Nunca creí que el amor era agua con sal


Nunca creí que el amor era agua con sal",https://www.letras.com//jose-jose/agua-con-sal/
José José,Ahora No,"Ahora no


Será otra vez


Ahora no


No puedo hoy


Será después


Ahora no


Será otra vez


Ahora no


No puedo hoy


Será después


Y así


Te has pasado todo el tiempo


Desde que te conocí


Yo no se porque no quieres tú


Conmigo un día salir


No pienses mal de mi cariño


Te quiero bien


Te ofrezco amor


Podemos solo ser amigos


Si no me quieres como yo


Ahora no


Será otra vez


Ahora no


No puedo hoy


Y cuando pues


Y yo sigo y sigo enamorado


Cada día mas de ti


El mismo tiempo que tengo de tanto y tanto insistir


No pienses mal de mi cariño


Te quiero bien


Te ofrezco amor


Podemos solo ser amigos


Si no me quieres como yo


Ahora no


Será otra vez


Ahora no, ahora no


Será después


Ahora no


Será otra vez


Ahora no, no puedes hoy


Y cuando pues


Ahora no


Ahora no, ahora no


Y cuando pues",https://www.letras.com//jose-jose/ahora-no/
José José,Ahora o Nunca,"Me sentí culpable al besar tu piel


Retiré mi cuerpo de tu cuerpo


No debo hacerlo, pensé


Te sentiste herida te pusiste en pie


Dije no te enfades, pero eres


Demasiado niña, para ser mujer


Vete a qué esperas muchacha


Ponte tu vestido y guarda tus sueños


Vete ahora o nunca a qué esperas muchacha


Ponte tu vestido y guarda tus sueños


Vete ahora o nunca


Me sentí ridículo y dudo si hice bien


Pensarás tal vez que soy un tonto


Poder amarte y no querer


Hice que tus lágrimas no te acompañen


Dije ten paciencia que a tus años


No debes estrenar aún tu piel


Vete a qué esperas muchacha


Ponte tu vestido y guarda tus sueños


Vete ahora o nunca a qué esperas muchacha


Ponte tu vestido y guarda tus sueños


Vete ahora o nunca


Vete a qué esperas muchacha


Ponte tu vestido y guarda tus sueños


Vete ahora o nunca a qué esperas muchacha


Ponte tu vestido y guarda tus sueños


Vete ahora o nunca",https://www.letras.com//jose-jose/ahora-o-nunca/
José José,Alas,"Señor


Por encima de todas las cosas


Tu voluntad esta


Y yo la amo


Porque soy parte de ella


Se que mi vida no terminara


En las alas


De tu voluntad


Más tarde o más temprano


La vida se va


Allá donde tu recreas


Con música infinita


Y jardines de estrellas


En las alas


De tu voluntad


Más tarde o más temprano


La vida se va


Señor tu voluntad es bella


Y la amo


Yo la amo


En las alas


De tu voluntad


Más tarde o más temprano


Yo quiero llegar


Señor allá donde mi amigo


Que goza para siempre de tu bondad",https://www.letras.com//jose-jose/alas/
José José,Aléjate,"Te juro (te juro)


Que no comprendo y me atormento


Te vas y vienes y a tu antojo te tengo


(Te tengo)


Quisiera (quisiera)


Que alguna vez, por una vez me lo dijeras


Y nada de nada


Ya ni siquiera tu sonrisa me acompaña


Aléjate


Si yo no soy lo que tú habías soñado


Y aún no sé si he sido yo quien ha fallado


Di lo que sientes, a ver si de una vez me aclaro


Aléjate


Si yo no soy lo que tú habías soñado


Di lo que sientes, a ver si de una vez me aclaro


Y si me quieres, quédate para siempre


Aléjate


Te juro (te juro)


Que no comprendo y me destruyo


Te vas y vienes y a tu antojo soy tuyo


(Soy tuyo)


Quisiera (quisiera)


Que alguna vez, por una vez me lo dijeras


Y nada de nada


Ya ni siquiera tu sonrisa me acompaña


Aléjate


Si yo no soy lo que tú habías soñado


Y aún no sé si he sido yo quien ha fallado


Di lo que sientes, a ver si de una vez me aclaro


Aléjate


Si yo no soy lo que tú habías soñado


Di lo que sientes, a ver si de una vez me aclaro


Y si me quieres, quédate para siempre


Aléjate",https://www.letras.com//jose-jose/135203/
José José,Alguien,"Un día que estés muy sola y tengas tiempo de pensar


Acuérdate de alguien a quien tú enseñaste a amar


Que te quiso con pasión


Desmedida


Sin importarle nada, que no fueras tú


Ese alguien que giraba siempre alrededor de ti


Era alguien que se daba con darse nunca vi


Y entonces, si todavía tienes tiempo


Si todavía estás muy sola, recuerda que ese alguien


Ese alguien, de quien te hablo


Ese alguien que te quiso, como nadie


Ese alguien, sigo siendo yo",https://www.letras.com//jose-jose/alguien/
José José,Alguien Que Te Extraña,"Son las dos de la mañana


Cuando escribo esta carta


Parece más un poema de amor


Es de alguien que te extraña


Son las dos de la mañana


Cuando escribo esta carta


Es de alguien que desea verte


Pues te quiere todavía


Pensé que al alejarme


Yo te olvidaría


Pero me equivoqué, me equivoqué


Y en vez de olvidarte, te adoro cada día


Que extraño es el amor


Son las dos de la mañana


Cuando escribo esta carta


La ausencia me ha servido


Al fin he comprendido


Que te quiero


Pues quien te escribe


Es alguien que te extraña


Pues quien te escribe


Es alguien que te extraña",https://www.letras.com//jose-jose/alguien-que-te-extrana/
José José,Alguien Vendrá,"La soledad es pasajera


Siempre se va tal como llega


Alguien habrá que esté esperando


Para darte el amor que va guardando


No pienses más, alguien te espera


Para entregar, el alma entera


Se encontrarán por el camino


Y se amarán, se amarán, se amarán


Alguien dará


Todo su amor por ti


Alguien vendrá


Y tú serás feliz


Alguien dará


Todo su amor por ti


Alguien vendrá


Y tú serás feliz


La soledad es pasajera


Siempre se va tal como llega


Alguien habrá que esté esperando


Para darte el amor que va guardando


No pienses más, alguien te espera


Para entregar, el alma entera


Se encontrarán por el camino


Y se amarán, se amarán, se amarán


Alguien dará


Todo su amor por ti


Alguien vendrá


Y tú serás feliz


Alguien dará


Todo su amor por ti


Alguien vendrá


Y tú serás feliz


Alguien dará


Todo su amor por ti


Alguien vendrá


Y tú serás feliz


Alguien dará


Todo su amor por ti


Alguien vendrá


Y tú serás feliz",https://www.letras.com//jose-jose/alguien-vendra/
José José,Almohada,"Amor como el nuestro


No hay dos en la vida


Por más que se busque


Por más que se esconda


Tú duermes conmigo


Toditas las noches


Te quedas callada


Sin ningún reproche


Por eso te quiero


Por eso te adoro


Eres en mi vida


Todo mi tesoro


A veces regreso borracho de angustia


Te lleno de besos y caricias mustias


Pero estás dormida, no sientes caricias


Te abrazo a mi pecho, me duermo contigo


Mas luego despierto, tú no estás conmigo


Solo está mi almohada


A veces te miro


Callada y ausente


Y sufro en silencio


Como tanta gente


Quisiera gritarte


Que vuelvas conmigo


Que si aún estoy vivo


Solo es para amarte


Pero todo pasa


Y a los sufrimientos


Como a las palabras


Se las lleva el viento


Por eso regreso borracho de angustia


Te lleno de besos y caricias mustias


Pero estás dormida, no sientes caricias


Te abrazo a mi pecho, me duermo contigo


Mas luego despierto, tú no estás conmigo


Solo está mi almohada",https://www.letras.com//jose-jose/135204/
José José,Ámame,"Es tanto tiempo ya


Que hoy quisiera saber


Sí aún vivo en tu mirar


Si tú sueñas con volver


Pues siento soledad


En cada amanecer sin ti


La distancia tal vez


Es desierto que en mí


Hace crecer la sed


Que ya tenía de ti


Y hace mi voz clamar


En cada anochecer por ti


Ven a mí


Quiero decirte tantas cosas


Quiero escucharte que no ignoras


Que cada vez te quiero más


Ámame


Pues con tu amor me das la vida


Y con tus besos vuelves día


La oscuridad de mi vivir",https://www.letras.com//jose-jose/747477/
José José,Amándote,"Eres el final de mi viaje


La ensenada donde mi


Ansiedad


Puede al fin soltar el equipaje


Y admirando tu paisaje


Empezar a descansar


Eres ya mi última aventura


Un oasis de tranquilidad


En el vendaval de mi locura


La respuesta a mis preguntas


Y mi única verdad


Amándote


Mi vida es diferente


Amándote


Es fácil sonreír


Nada más puedo decir


Que viviendo junto a ti


Soy tan feliz como un niño feliz


Amándote


Mi vida es diferente


Amándote


Es fácil sonreír


Nada más puedo decir


Que viviendo junto a ti


Soy tan feliz como un niño feliz


Tienes en tus manos mi futuro


Mi pasado no es más que un borrón


Nunca un sentimiento tan profundo


Tan hermoso, limpio y puro


Inundó mi corazón


Amándote


Mi vida es diferente


Amándote


Es fácil sonreír


Nada más puedo decir


Que viviendo junto a ti


Soy tan feliz como un niño feliz


Amándote


Mi vida es diferente


Amándote


Es fácil sonreír


Nada más puedo decir


Que viviendo junto a ti


Soy tan feliz como un niño feliz",https://www.letras.com//jose-jose/amandote/
José José,Amantes,"Amantes


Que pasaron por mi vida


Aliviando las heridas


De mis fracasos de amor


Amantes


Que escondidos en la sombra


Me entregaron tiernamente


El secreto de un amor


Sabrán, que fueron para mí


La luz, en noches de tormenta


Y así, tan solo con su amor


Sobreviví, sin darme cuenta


Amantes


Que llenaron mis vacíos


Igual que el agua a los ríos


Con nuestros sueños de amor


Amantes


Que compartieron mis penas


Sin promesas ni cadenas


Amor a cambio de amor


Sabrán, que fueron para mí


La luz, en noches de tormenta


Y así, tan solo con su amor


Sobreviví, sin darme cuenta


Sabrán, que el tiempo pasará


¡Quizá, mi vida siga herrante!


¡Quizá, jamás las vuelva a ver!


Pero yo sé, que nunca olvidaré


Amantes",https://www.letras.com//jose-jose/amantes/
José José,Amar Sin Ser Amado,"Ya sé que vas a dejarme


Qué lo tienes decidido


Qué no te importa mi pena


Ni el saber que estoy herido


Qué ya no quieres quedarte


A mi lado ni un momento


Qué es mi problema y no el tuyo


Si no aguanto el sufrimiento


Ya sé que nunca me has dicho


Que de veras me querías


Qué no pediste cariño


Ni dijiste que eras mía


Qué tú eres ave de paso


Y es por eso que hoy te vas


Ya sé que la culpa es mía


Por quererte demasiado


Qué estoy sufriendo por tonto


Por amar sin ser amado


Y lo que más me entristece


Qué le has dicho a los amigos


Que no es que ya no me quieras


Es que nunca me has querido


Ya sé que nunca me has dicho


Que de veras me querías


Qué no pediste cariño


Ni dijiste que eras mía


Que tú eres ave de paso


Y es por eso que hoy te vas


Ya sé que la culpa es mía


Por quererte demasiado


Qué estoy sufriendo por tonto


Por amar sin ser amado


Y lo que más me entristece


Qué le has dicho a los amigos


Que no es que ya no me quieras


Es que nunca me has querido


Ya sé que la culpa es mía


Por quererte demasiado


Qué estoy sufriendo por tonto


Por amar sin ser amado


Y lo que más me entristece


Qué le has dicho a los amigos


Que no es que ya no me quieras


Es que nunca me has querido",https://www.letras.com//jose-jose/amar-sin-ser-amado/
José José,Amar y Querer,"Casi todos sabemos querer


Pero pocos sabemos amar


Es que amar y querer no es igual


Amar es sufrir, querer es gozar


El que ama pretende servir


El que ama, su vida la da


Y el que quiere pretende vivir


Y nunca sufrir, y nunca sufrir


El que ama no puede pensar


Todo lo da, todo lo da


El que quiere pretende olvidar


Y nunca llorar, y nunca llorar


El querer, pronto, puede acabar


El amor no conoce el final


Es que todos sabemos querer


Pero pocos sabemos amar


El amar es el cielo y la luz


El amar es total plenitud


Es el mar que no tiene final


Es la gloria y la paz, es la gloria y la paz


El querer es la carne y la flor


Es buscar el oscuro rincón


Es morder, arañar y besar


Es deseo fugaz, es deseo fugaz


El que ama no puede pensar


Todo lo da, todo lo da


El que quiere pretende olvidar


Y nunca llorar, y nunca llorar


El querer, pronto, puede acabar


El amor no conoce el final


Es que todos sabemos querer


Pero pocos sabemos amar


El que ama no puede pensar


Todo lo da, todo lo da


El que quiere pretende olvidar


Y nunca llorar, y nunca llorar


El querer, pronto, puede acabar


El amor no conoce el final


Es que todos sabemos querer


Pero pocos sabemos amar",https://www.letras.com//jose-jose/135213/
José José,Amnesia,"Usted me cuenta que nosotros dos


Fuimos amantes


Y que llegamos juntos a vivir


Algo importante


Me temo que lo suyo es un error


Yo estoy desde hace tiempo sin amor


Y el último que tuve fue un borrón


En mi cuaderno


Usted me cuenta que hasta le rogué


Que no se fuera


Y que su adiós dejó a mi corazón


Sin primavera


Que anduve por ahí de bar en bar


Llorando sin podérmela olvidar


Gastándome la piel en recordar


Su juramento


Perdón, no la quisiera lastimar


Tal vez, lo que me cuenta sea verdad


Lamento contrariarla, pero yo


No la recuerdo


Que anduve por ahí de bar en bar


Llorando sin podérmela olvidar


Gastándome la piel en recordar


Su juramento


Perdón, no la quisiera lastimar


Tal vez, lo que me cuenta sea verdad


Lamento contrariarla, pero yo


No la recuerdo",https://www.letras.com//jose-jose/135205/
José José,Amor,"Amor, es lo que siente la gente


Cuando se enamora


Yo lo siento ahora, en el


Corazón


Por ti, por ti, por ti


Amor es lo que todo lo puede estando a tu lado


Ya me has confesado, que también me quieres


Amor, lo que yo siento al mirarte


Lo que yo siento al hablarte


Lo que por ti yo he sentido


Desde aquel momento


En que me miraste


Y que no me deja vivir sin ti


Amor, es lo que siente la gente, cuando se enamora


Yo lo siento ahora, en el corazón


Por ti, por ti, por ti, amor


Por ti, por ti, por ti, amor",https://www.letras.com//jose-jose/amor/
José José,Amor Amor,"¿Dónde está el amor?


¿Alguien lo ha encontrado?


Por favor, oh no


¿Dónde puede ir?


Puede estar herido


Pero no morir


Puede estar cansado


Puede estar encadenado


O quizás esté dormido


A la sombra de un olvido


Amor, amor


Que te pintas de cualquier color


Tan profundo como el viento


Tan lejano como el tiempo


Y tan cierto como el Sol


Amor, amor


Si me escuchas y me puedes ver


No me cierres tu guarida


Llena un poco de mi vida


Llena un poco de mi ser


¿Dónde puede estar


El amor que un día


Se llevó la mar?


¿Cuándo volverá?


Puede que no vuelva


Nunca más, quizás


Puede estar perdido


Puede estar desfallecido


O quizás esté sentado


A la puerta del pasado


Amor, amor


Que te pintas de cualquier color


Tan profundo como el viento


Tan lejano como el tiempo


Y tan cierto como el Sol


Amor, amor


Si me escuchas y me puedes ver


No me cierres tu guarida


Llena un poco de mi vida


Llena un poco de mi ser


Amor, amor


Que te pintas de cualquier color


Tan profundo como el viento


Tan lejano como el tiempo


Y tan cierto como el Sol


Amor, amor


Si me escuchas y me puedes ver


No me cierres tu guarida


Llena un poco de mi vida


Llena un poco de mi ser",https://www.letras.com//jose-jose/135206/
José José,Amor de Discoteque,"Te encontré una vez


Bailando sola en una discoteque


Y no sé por qué me enamoré de ti


Y de tu forma de bailar


Cuando te miré


Tus grandes ojos me hicieron vibrar


Y no pude hablar parado me quedé


A media pista, sin saber que hacer


A la chica que venía conmigo


Sola la dejé, ya no supe más


Tomé tus manos y empezamos a bailar


A bailar


Un poco después


Salimos juntos de la discoteque


Fuimos a cenar y platicando


Fue así como empezó nuestro querer


Pronto descubrí


Que eres la chica para quien nací


Lo supe muy bien


Pues nunca antes había sentido lo que ahí sentí


La cuenta pagué


Y abandonamos el lugar aquel


Para caminar, pues esa noche


Era perfecta para amar


Al llegar a un parque


Nos sentamos y tu mano yo tomé


Luego te abracé y por primera vez


Con fuerza te besé, te besé


Fue después de un mes


Que te pedí que fueras mi mujer


Dijiste que sí y nos casamos


Allá en aquella discoteque


Donde te conocí


Donde me enamoré de ti


En la discoteque


Donde te conocí


En la discoteque


Donde me enamoré de ti",https://www.letras.com//jose-jose/amor-de-discoteque/
José José,Amor Lo Que Se Dice,"Recordarás mi casa amor


Y llamarás corriendo


Vendrás a huir del ruido amor


Y te daré silencio


Me dejarás que cuide de ti


Como a un pequeño siervo


Y que te dé cobijo y amor


Y un sitio en mi brasero


Y una mirada dulce


Una caricia


Un beso


Porque amor lo que se dice amor


Amor lo que se dice amor


Amor lo que se dice amor


Es poco más o menos eso


Y cuando tengas pan de mi pan


Y sal de mi salero


Te sentirás agusto amor


Y me dirás te quiero


Y cuando quieras irte amor


Te abrigaré primero


Y te daré mi llave amor


Y luz en el sendero


Y una mirada suave


Una caricia


Un beso


Porque amor lo que se dice amor


Amor lo que se dice amor


Amor lo que se dice amor


Es poco más o menos eso",https://www.letras.com//jose-jose/amor-lo-que-se-dice/
José José,Amor Mio,"Amor mío


Tu rostro querido no sabe guardar secretos de amor


Ya me dijo que estoy en la gloria de tu intimidad


No hace falta decir que me quieres


No me vuelvas loco con esta verdad


No lo digas, no me hagas que llore de felicidad


Cuanta envidia se va a despertar


Cuantos ojos nos van a mirar


La alegría de todas mis horas


Prefiero pasarlas en la intimidad


Olvidaba decir que te amo


Con todas las fuerzas que el alma me da


Quién no ha amado que no diga nunca que vivió jamás


Cuanta envidia se va a despertar


Cuantos ojos nos van a mirar


La alegría de todas mis horas


Prefiero pasarlas en la intimidad


Olvidaba decir que te amo


Con todas las fuerzas que el alma me da


Quién no ha amado que no diga nunca que vivió jamás",https://www.letras.com//jose-jose/amor-mio/
José José,Amor Para Los Dos,"Fue una noche tibia cuando yo te conocí


Y desde aquel instante yo me enamoré de ti


Hiciste que brotara en medio de mi corazón un gran amor para los dos


Estabas tan preciosa


Que no me atreví a contemplar tu linda cara y tu boca de rubí


Tus ojos que brillaban como la Luna en el mar


Decían que me querías igual


Con todas esas cosas tan hermosas que bien sabes significas para mí


Puedes estar segura que todo mi cariño es para ti


Fue una noche tibia cuando yo te conocí


Y desde aquel instante yo me enamoré de ti


Tus ojos que brillaban como la Luna en el mar


Decían que me querías igual",https://www.letras.com//jose-jose/amor-para-los-dos/
