Banda,Título,Letra,Link
Bad Bunny,Me Importa Un Carajo,"(Yo-Yo-Young Martino)


(Bad Bunny)


Me dicen que tenga cuidado con lo que yo escriba


Cuando muera, no sé si voy para abajo o para arriba


Voy a hacerme millo' aunque tenga que dar la vida


Voy a seguir hasta que Dios decida


Voy a seguir hasta que Dios decida


Que mucho se dice de mí, casi todo es falso


Ustedes roncando con Retros y yo con su jeva chingando descalzo


Me dicen: Conejo, no seas egoista, no te dañes


Les digo: Primero yo, segundo yo, como Kanye


Ya tú conoces mi voz, el jefe de jefes, Hugo Boss


Soy como en Miami, Rick Ross


Si me oyes tosiendo, no es que tengo tos


Es que en la guagua siempre he prendi'o más de dos, ah


Yo no voy a la iglesia, pero conmigo siempre anda Dios


Dime quiénes son, si tienen corazón


O por lo menos razón pa' hablar de mí (pa' hablar de mí)


Dime quiénes son, si tienen corazón


O por lo menos razón pa' hablar de mí, porque


Me importa un carajo


Lo que hablen de mí, lo que hablen de mí


Lo que hablen de mí, lo que hablen de mí


Me importa un carajo


Se van a morir, se van a morir


Hablando de mí, hablando de mí


Me importa un carajo


Lo que hablen de mí, lo que hablen de mí


Lo que hablen de mí, lo que hablen de mí


Me importa un carajo


Se van a morir, se van a morir


Hablando de mí, hablando de mí


Soy el 3 de los Sixers, dándole un pegue hasta al 23


Hablen lo que quieran, cabrones, first bless


No es que sea vicioso, es que sufro de estres


Yo soy Bobby Fischer y esto es ajedrez


Tírense todos a la vez, que al que me toque lo crucifican al revés


En la buena to' el mundo, en la mala desierto


Mil favores que no me han devuelto


Yo sólo confio en los chavos, por ellos yo invierto


Voy a hacerme rico antes de muerto


Los sueños se cumplen si sueñas despierto


Le meto diez años y como Hector después me convierto


¡Amen!


Me importa un carajo


Lo que hablen de mí, lo que hablen de mí


Lo que hablen de mí, lo que hablen de mí


Me importa un carajo


Se van a morir, se van a morir


Hablando de mí, hablando de mí


Me importa un carajo


Lo que hablen de mí, lo que hablen de mí


Lo que hablen de mí, lo que hablen de mí


Me importa un carajo


Se van a morir, se van a morir


Hablando de mí, hablando de mí


Me dicen que tenga cuidado con lo que yo escriba


Cuando muera, no sé si voy para abajo o para arriba


Voy a hacerme millo' aunque tenga que dar la vida


Voy a seguir hasta que Dios decida


Voy a seguir hasta que Dios decida",https://www.letras.com//bad-bunny/me-importa-un-carajo/
Bad Bunny,"Me Llamas (part. Arcangel, De La Ghetto, Amenazzy y Mark B)","[Mark B y Bad Bunny]


Son tantas cosas que yo te quiero hacer (yo te quiero hacer)


To' las posicione', mami, me las sé (mami, me las sé)


Si te gusta el humo, podemos prende' (¡podemos prende'!)


Cuando te sientas sola


[Mark B]


Tú solo me llamas


Me llamas, me llamas


Yo te lo hago to' el día


Me llamas


Me llamas, me llamas


Y te la saco to' el día


Uoh, oh, solo tú y yo


Uoh, oh, en la habitación


Uoh, oh, solo tú y yo


Uoh, oh-oh-oh, oh, oh-oh-oh, oh


[Bad Bunny]


Bebé, ¿qué lo que?


Tú te viniste cuando te toqué (eh), yeh


Yo te provoqué (¡skrt!)


Ese bumper yo te lo choqué (eh)


Me llama pa' que le dé, la más dura de R.D. (yeh)


Te pego a la pared, yo soy tu nene, tú eres mi bebé (-bé)


Tengo un iPhone pa' cuando me llame'


Otro pa' grabarte cuando me lo mame' (cuando me lo mame')


Esta gente tirándote el juego y yo soy el del punto del gane


Como un kilo, pa' New York te subí


Fui donde el russo y busqué la franco y el rubí


En to' las poses te di, escuchando mis tema' y los de Mark B, yeh


[Bad Bunny y Amenazzy]


Y ahora me llamas (-mas)


Me llamas (-mas), me llamas (-mas)


(Y te lo hago to' el día)


Ahora me llamas (me llamas)


Me llamas (me llamas), me llamas (ah, ah)


(Y te la saco to' el día)


Ey-yao', el nene


Se enamoró desde que se lo metí ese primer día


Después que conmigo ella no quería


Ahora me llama pa' que yo le dé


¿Có-cómo la ve'? El que manda soy yo


Me vengo, lo gasto con ese culón


De tanta confianza no usamo' condón


No bebe otra cosa que no sea patrón, skrt, skrt (¡skrt, skrt!)


Soy el que llama cuando no hay na' que hace'


(No hay na' que hace')


Por mí, su jevo ella ya no lo ve


(Ya no lo ve)


La puse a bebe' lean con percocet, -cocet


Cuando se siente sola, jaja


(Y ahora me llamas)


Siempre lo hacemo' donde ella quiera


Terminamo' de hacerlo y conmigo se queda


Sabe que no es la única y no se me queja


Se pone de espalda' y su culo lo pone en mi cara


Mientra' yo se lo meto me dice


Que lo saque ante' que ella se la, hah, jaja


El nene


[De La ghetto y Mark B]


Me llamas


Me llamas, me llamas


Yo te lo hago to' el día


Me llamas (uh)


Me llamas, me llamas


Y te la saco to' el día


[Arcángel]


Ah; austin, baby, yao'


Quiero ponértelo


'Tá de más que diga que yo quisiera hacértelo


Eso allá abajo yo voy a besártelo (muah)


Y si está seco, yo quiero mojártelo


El novio tuyo


'Tá de más que diga que yo puedo rompértelo


Atendértelo (aha), sacarlo a pasear y desaparecértelo


Yo sé que te gusta cuando llama' y te contesto (ajá)


A cualquier hora que tú quiera' y no me molesto (nope)


Si tú quiere', seguimo' el libreto (yes)


Normal, lo dejamo' en secreto (okay)


Tú sabe' que yo soy discreto


A nadie le digo cuando yo te lo meto (woah)


Y seguimo' la rumba, tranquila, que nadie me tumba (no-no)


La cama se inunda cuando esas nalgas retumban (Austin, baby)


Soy el que quiere' que calme tus ansias


Con sentimiento, maldad y elegancia, ah


[Mark B]


Te lo hago de to' las manera'


Como a ti te gusta, mami, te la vo'a sacar


En la cama o en la bañera


Hasta que me grites, ¡papi, ya no puedo más!


Me gusta cómo tú te menea'


Y me pone esa cara de fresca


De mi cura tiene' la receta


Así que, ven, pa' comerte completa


Tú solo me llamas cuando salgas de la discoteca


Me llamas si tu novio te deja incompleta


Me llamas, dile que el que ese soy yo


Me llamas, dale, marca mi número


[De la ghetto & Bad Bunny]


Me llamas


Me llamas, me llamas


(Y te lo hago to' el día)


Me llamas (uh)


Me llamas, me llamas


(Y te la saco to' el día)


[De La Ghetto]


Se trepa encima, no hay quien la baje


No quiere quitarse hasta que no termina


Le gustan los threesome', le gustan las molly


También besarse con to'a las amiga'


La toco y la mojo (wuh), le bajo rápido ese panty rojo (wuh)


Lo meto pa' adentro hasta hace' que se le viren los ojos


Siempre le gusta hacerlo conmigo y por eso me busca


Aunque tenga novio soy el mejor que a ella se lo unta


No hace pregunta'


Siempre que empieza no quiere para-a-ar


Siempre me llama pa' que le vuelva a da-a-ar


Ey


Arcangel, pa'


Mark B


De La Geezy


Bad Bunny


La Amenazzy


Hear this music


Alofoke music


Mailo peñalo


Dí-, díselo, luian


Mambo kingz


Light gm


Bf


Esta es la unión de R.D. y Puerto Rico


Jajaja, ey


(Ey-ya')


Aquí hay que batear de 400 pa' arriba


Bombon productions


Prra


(2017, jaja)


Alofoke music, homie


Lo más duro",https://www.letras.com//bad-bunny/me-llamas-part-arcangel-de-la-ghetto-amenazzy-y-mark-b/
Bad Bunny,Me Llueven (part. Poeta Callejero y Mark B),"Bad Bunny baby


El poeta callejero


Mark B


[Bad Bunny]


El dinero me llueve


Las putas a mi me llueven (me llueven)


Los envidiosos a mi me llueven


Hablan mierda y las balas a ti llueven (te llueven)


El dinero a mi me lllueve (yeah)


Las putas a mi me llueven


Los envidiosos a mi me llueven


Hablan mierda y las balas a ti llueven (yeah)


[Poeta Callejero]


Yo dije que si progreso no iba a ser atentoso


Que no me voy a comprar un carro lujoso


Pero, si yo no gozo lo que yo trabajo


De que me sirve ser muy poderoso


Me lo merezco, fama, poder y respeto


Pa mi hija bonita que es mi princesa


Yo quiero fama, salud y riqueza


Dando al que me crío, sacarlo de la pobreza


Y una moña pa la doña


Pa mi mujer una moña


La moña pa su mamá


Y a su papá le tengo otra moña


[Bad Bunny]


El dinero me llueve


Las putas a mi me llueven (me llueven)


Los envidiosos a mi me llueven


Hablan mierda y las balas a ti llueven (te llueven)


El dinero a mi me lllueve (yeah)


Las putas a mi me llueven


Los envidiosos a mi me llueven


Hablan mierda y las balas a ti llueven (yeah)


[Mark B]


Si me critican no me desanima


Lo que sea que digan, me hace mejor


Yo no naci pa perder


Nací para ser campeon


Celebro con champaña


Con 4 mujeres en una cabaña


Con mi dinero se baña, en el tubo rápido se engancha


Yo no compro desan barata


Saco, saco y nunca se dañan


El dinero me llueve


Las mujeres me llueven


Los variados me llueven


A mi todo me llueve


[Bad Bunny]


Más culos en un putero


De mujeres tengo un aguacero


Una tormenta de dinero


Por que en la cuenta tengo un par de cero


Mi flow es aparte


Lo dijo alofoke que yo soy de Marte


Matarlos pa mi es un arte


Yo soy de RD me lo dijo duarte


El dinero me llueve


Las putas a mi me llueven (me llueven)


Los envidiosos a mi me llueven


Hablan mierda y las balas a ti llueven (te llueven)


El dinero a mi me lllueve (yeah)


Las putas a mi me llueven


Los envidiosos a mi me llueven


Hablan mierda y las balas a ti llueven (yeah)


Bad Bunny baby


El conejo malo


Dímelo puñeta


Mark B


Dímelo alofoke


Hear This Music


PR RD


La conbinacion más hijueputa desde los siglos


De los siglos, amen",https://www.letras.com//bad-bunny/me-llueven-feat-poeta-callejero-y-mark-b/
Bad Bunny,"Me Llueven 3.0 (part. Kevin Roldan, Noriel, Bryant Myers y Almighty)","Fuse Music


No-No-Noriel


KR, baby


Bryant Myers, me llueven, me llueven


Con Light G, con Light G


[Bad Bunny]


El dinero me llueve


Las putas a mí me llueven


Los envidiosos a mí me llueven


Habla mierda y las balas a ti te llueven, te llueven


El dinero a mí me llueve (yeah)


Las putas a mí me llueven


Los envidiosos a mí me llueven


Habla mierda y las balas a ti te llueven


[Kevin Roldán]


Con KR el cielo se les pone gris, opaca'o infeliz


¿Qué te llueve?


Te llueve perico por la nariz


Voy dejando cicatriz, a to's estos sala'os


Va a ver lluvia de bala, ando en la Cadillac blindao


Yo no hago ni medios, ni televisión (¿Pa' que?)


Yo soy la pauta, la situación


Matándolos, canción por canción


A ustedes le llueven las gorras


A mí me llueven la mansión (KR, baby)


Verte pa' darte en la cara


Los que no quieren verme


No fue buena suerte


Menos mal que los fans vieron como yo tuve que joderme


Ahora no pueden detenerme


Sólo pueden verme en el Lambo, en el Rari


A mí


[Bad Bunny]


El dinero me llueve


Las putas a mí me llueven


Los envidiosos a mí me llueven


Habla mierda y las balas a ti te llueven, te llueven


El dinero a mí me llueve (yeah)


Las putas a mí me llueven


Los envidiosos a mí me llueven


Habla mierda y las balas a ti te llueven


[Noriel]


Yo controlo el weather channel


Tengo par de babies tirándome por el scanner


Lo que yo quiera que me llueva


Me llueve sí aprieto un sólo botón del control panel


Yo tengo de to', me lo busco to'


Recuerda, lo fácil no se falla


To's estos cabrones me siguen los pasos


Pero como quiera se guayan


Larga vida al envidioso


Pa' que vea to' lo que yo gozo


Aunque me tiren la mala


Me voy a hacer millo sin volver a tocar un coso


A mí no existe quien me toque


Dímelo rápido, Foke


Que siga lloviendo el dinero


Aunque de verda' ya yo tenga lleno el pote


[Bad Bunny]


El dinero me llueve


Las putas a mí me llueven


Los envidiosos a mí me llueven


Habla mierda y las balas a ti te llueven, te llueven


El dinero a mí me llueve (yeah)


Las putas a mí me llueven


Los envidiosos a mí me llueven


Habla mierda y las balas a ti te llueven (yeah)


[Bryant Myers]


Tú te pasa hablando más mierda, cabrón


Y cuando tú me ves de frente, me vienes a saludar


Si te pillo, te la vas a buscar


Tú y to' el que te vaya a ayudar (¿Oíste?)


Aguanta el paladar


Si tú me falta el respeto, te voy a dar


Te tenemos un radar


Hoy tú te vas a quedar en el expreso Martínez Nadal


Ustedes me quieren tumbar


Pero ninguno se atreve a zumbar


El AK en el pecho te va a retumbar


Yo nunca voy a insectiar


A mí me llueven culos, bestial


Yo soy real, yo soy leal


Cabrón, yo tengo bendición celestial


[Almighty]


Las putas me llueven y, mientras me llueven, se mojan


El dinero me llueve, pégate a mi nube pa' que lo recojan


No quiere bala, mi herma', desaloja


Aprende a surfear, por ahí viene la ola


Yo vivo en Hawáii, bajo el cristal, grito: ¡Aloha!


Y terminan quema'os como el pasto y la hoja


Pa' tu pregunta tengo la respuesta


Soy un iPhone 7 con Siri


Primera clase, ustedes en Spirit


No me entiendes, te hago un video lyric


Si tú eres Biggie, yo soy tu papá


Vo' a ponerme de apodo P. Diddy


Pa' los gustos, están los colores


Y, señores, soy un arco iris


Almighty


El dinero a mi llueve


Bad Bunny


Bryant Myers, La Oscuridad


Kevin Roldán, baby


No-No-Noriel


Almighty


Alofoke Music


Fuse Music


Con Light G


Light GM


Fuse Music


Dímelo, Alofoke


Mezclando los efectos


Nico, de Dominicana a Puerto Rico


Trap Capos, brrr


Los bori con los domi


Seguimos rompiendo, puñeta


Hipócritas


Fuse Music",https://www.letras.com//bad-bunny/me-llueven-30-part-kevin-roldan-noriel-bryant-myers-y-almighty/
Bad Bunny,"Me Mata (part. Arcangel, Bryant Myers, Almighty, Noriel, Baby Rasta y Brytiago)","[Bad Bunny]


Tú estás buena, bebé, y sin mandarte a hacer


Quiero fumar y darte hasta el amanecer


Te juro que me gusta todo de ti


Todo de ti


Pero lo que me mata


Es cuando pone cara de bellaca


Se besa con la amiga y no son pata’


Fina pero en la cama tremenda sata


[Baby Rasta]


Y lo que a mí me mata


Es cuando pone cara de bellaca


Tú misma baja' el zíper y lo saca'


Fina pero en la cama tremenda sata, yeh


[Arcángel]


(Austin, baby)


Me bebí un jarabe, que es pa’ la tos


Le pedí una amiguita y me trajo dos


Le metí toda la noche a lo nivel Dios


Me llegó el regalo adelantado de Santa Claus (wow)


Fuerte y no fue golpe de suerte (no)


Le di una pastilla y se puso indecente (loquita)


Aunque media loquita, la dé mente


La enseñé este bicho y se puso coherente


Por eso ella siempre me llama


Cada vez que ella está sola


Cuando llego, me lo mama


Bien rico, no importa la hora


Siempre se me manifiesta


Luego tomamo’ una siesta


Despertamo’ y se me trepa encima


Y pa’ hacerlo de nuevo se presta (Noriel)


[Noriel]


Mi baby es una atrevida


Quiere chingar conmigo de por vida


El novio un par de veces se las pegó


Porque ese cabrón la tenía aburrida


Siempre que la llamo, le llega enseguida


To' lo que me gusta nunca se le olvida


Quieres que te diga: Ella va a ser leal a este bicho


Mientras el cabrón tenga vida


Se toca y me baila


Si anda con la amiga, digo que la traiga


Pon el teléfono en modo de avión


Pa’ que nunca le suene y no se me distraiga


Siempre echamos más de uno


Se envuelve en el humo, fuma si yo fumo


La baby dice que no es pata


Pero le encanta los dos pa' uno


Todo los trucos, ella se lo sabe


Chingando tiene la clave


Que los dos pensamos iguales


Y en la cama todo se vale


Es una diabla


Que na’ más piensa en mí cuando está bellaca


[Bad Bunny]


Pero lo que me mata


Es cuando pone cara de bellaca


Se besa con la amiga y no son pata’


Fina pero en la cama tremenda sata


[Baby Rasta]


Y lo que a mí me mata


Es cuando pone cara de bellaca


Tú misma baja' el zíper y lo saca'


Fina pero en la cama tremenda sata, yeh


[Bryant Myers]


(Bryant Myers)


Hoy te vo’a torturar, baby, tu cuerpo es un mural


Ese culote es natural, yo te lo quiero inaugurar


Como un The Purge, esta noche yo te voy a depurar


Cuanto tú me va' a durar, ese totito hoy yo te lo voy a saturar


Tú eres una enferma


Y este bicho es el único que te va a curar


Yo sé que a ti y a la amiga tuya


También le encantan el bi’


Ustedes hacen threesome’ con cojone’


Ya casi parecen lesbi’, baby


En mi chalet hay, room service


Hoy te lo voy a meter completo


Hasta que te llegue a la pelvis


A tu ex cuando yo lo vi


Lo puse a correr toda la recta del presbi (Brytiago, baby)


[Brytiago]


Toda’ a las doce


Un feeling, ojito’ chiquito’, nadie las conoce’


Una es como Rihanna, la otra es Amber Rose


Adicta con ser atrevida


Loca con que una a la otra la roce


Se pasa metida en YouPorn


Buscando aprenderse todita' las poses


Me lo chupa y no para hasta que acaba


Me la grajeo con la lengua llena de baba


Sin phillies, dijo que no se arrebataba


Cuando tiene relaciones, ella misma es la que se graba


Vive viajando en éxtasis


Tú la ves por las redes y no se ve así


Yo soy un bellaco desde que nací


Le invite pa’ hacer un trio y las dos dijeron que sí


El sexo va a llover, exceso de placer


No sé si va a poder


Con toda las poses que le voy a hacer


Hoy no vamos a joder, apenas empecé


Yo abuso contigo, como mismo uso


De la tramadol y la percocet


[Baby Rasta]


Y lo que a mí me mata


Es cuando pone cara de bellaca


Tú misma baja' el zíper y lo saca'


Fina pero en la cama tremenda sata, yeh


[Almighty]


(Almighty, is The Game Changer)


Si tu amiga hoy no puede


Busca otra que diga que sí


Y se besan entre sí


Luego hacen la 6-9


Las dos se tocan y llueven


La pongo a fumar pa’ que se eleven


Baby, cumple mi fantasy


O es que tú no te atreve'


Llegó tu Roberto Clemente


También tu Chayanne, yo soy tu pirata


Quiero fumar con tu gata


Baby, yo cacho las libras de Gucci y Barata


Bajo con la aguja y la bata


Y te inyecto la tecata


Me lo mama, mientras se retrata


Si tú eres pata, yo meto las patas


Es tan poderosa, el buffet ponderosa


Son espinas sin rosa, ustedes son un libro


Y yo soy el lector que siempre las desglosa


Que Dios me perdone, ateo a los condone’


Me le vengo adentro y hasta el Sol de hoy no hay pensiones


Solo mis hijos y son estos cabrones, Almighty


[Bad Bunny]


Baby, yo soy tu Drake


Tú eres mi Rihanna (Rihanna)


Yo soy un bellaco bebe


Pero tú me gana’


Yo soy fan de tu boca


Tus nalgas, tus tetas, tus ojos y tu piel


Pero esa carita de bellaca


Es la que hace que yo te lo quiera meter


Ninguna puta le llega


Sale a janguear y a la casa no llega


Tiene novio, pero se las pega


Mi bicho es su hook y no se le despega


Baby, tú eres bellaca


Tú envías el location pa’ que lo confirme


Yo dándote bicho y tu novio metido en Planet Fitness


[Arcangel y Almighty]


Austin, baby


Arcángel, pa’


Bad Bunny


Bryant Myers (Almighty)


Noriel, Brytiago


Baby Rasta


Hear This Music


Dí-Díselo Luian


Mambo Kingz (espérate, dame un break)


Mambo Kingz, oh, yeah


Uy, Alex Killer


Mami, yo sé que tú estabas esperando


Que yo mencionara el bicho


O ¿qué tú quieres? ¿Que te hable de rifle y de pistola?


Si a última hora lo que yo te voy a meter es el bicho


(La industria de los inmortales)",https://www.letras.com//bad-bunny/me-mata/
Bad Bunny,Me Porto Bonito (part. Chencho Corleone),"Yeah-yeah-yeah-yeah-yeah-yeah


Ey


En la guagua, se quedó el olor de tu perfume


Tú ere' una bellaca, yo soy un bellaco


Eso es lo que no' une


Ella sabe que está buenota


Y no la presumen


Si yo fuera tu gato


Subiera una foto los vierne' y los lune' (So)


Pa' que to' el mundo vea


Lo rica que tú está', que tú está'


Contigo, tengo que apretar


Y еn la calle, ando suelto


Pero, por ti, mе quito


Si tú me lo pides


Yo me porto bonito


Y subo un selfie pa' que vean


Lo rica que tú está', que tú está'


Las otras tienen que apretar


En la calle ando suelto


Pero, por ti, mе quito


Si tú me lo pide'


Yo me porto bonito


Ey, ey


Tú no ere' bebecita


Tú ere' bebesota


Frikitona, ma', se te nota


Le gustan los trío' cuando está en la nota


Si el novio no sirve, de una lo bota


Y, wow


Mami, dime dónde dejo el resume


Sé que te dejaste hace un me'


Y de una de pecho, me zumbé


Si quiere', te hago un bebé


O te traigo la' plan B


Uff, mami, qué rica tú te ve'


Pa' los 2000, escuchaba RBD


Y ahora quiere perreo to'a la noche en la pared


Te obsesiono, CBD


Mami, tú ere' élite, no te me límite' (okey)


Déjame hacerte lo que amerite y te levite


Dale pa'l escondite, no te me arisque' (So)


Que aquí no van a poder llegar lo' satélite'


Mami, sube algo


Dame contenido


Ese culo, súbelo má' seguido


Me paso jangueando a ver si coincido, ey


Y por fin doy contigo


Mai, nuestra' bellaquera', nunca la' olvido


Ninguna como tú a mí me ha complacido


Tú cree' que a toda' siempre les digo lo mismo


Quiere chingar, pero no quiere na' fijo, ey


Pero, en confianza, me confiesa


Dice que nadie le interesa


Pero cuando sale, se pone traviesa


Pa' que to' el mundo vea


Lo rica que tú está', que tú está', ey


Contigo, tengo que apretar


Y en la calle ando suelto


Pero, por ti, me quito


Si tú me lo pide'


Yo me porto bonito",https://www.letras.com//bad-bunny/me-porto-bonito-part-chencho-corleone/
Bad Bunny,MERCEDES CAROTA (part. YOVNGCHIMI),"Chi-chi


Pla, pla, pla


To' pa' la carota


En la Mercedes Carota


Adidas entero como Rey Liotta


Good Fellas sin el prom, paguen la cuota (paguen la cuota)


Los Phillie' tuyo que son changa y eso se bota (y eso se bota)


Tusi con molly, diablo, qué nota (diablo, qué nota)


A la bebecita le mamo el toto, a la bebesota el culo y la tota


Mami, tú ere' Michael Jordan, sí, sí, jugando pelota, ey


De lejos se nota que tú no ere' calle, tú solo aparenta' (charro)


Cría bien tus hijo', cabrón, to' mis discos tienen el parental (chocha)


Aprovecha ahora, yo no voy a hacer esto hasta los cuarenta


Disco que saco, disco que se queda número uno en venta'


Diablo, ¿cuál es la quejadera, cabrón?


Habla, shh


Na, na, en verdad no me importa


Ni siquiera El Father sabía lo que en verdad era tener torta, ey


Nadie me soporta, ey


Seguridad con el presidente Biden


Pero pa' PR siempre bajo sin escolta (normal)


Jej, alguna mutilá', otras con licencia, pero aquí tos' andan con corta


Ey, ustede' lo dicen to', parecen un podcast


Cabrón, ¿y esa movie?, ¿a quién carajo es que tú le ronca'?


¿Tú ere' bichote? (No, no)


¿Tú ere' bandido? (No, no)


¿Tú mata' gente? (No, no)


¿Y qué tú ere'? ¿Y qué tú ere'?


¿Tú ere' un sicario? (No, no)


¿Tú ere' millonario? (No, no)


¿Tú manda en tu barrio? (No, no)


¿Y qué tú ere'? ¿Y qué tú ere'?


Ando en la Mercedes Carota


Sesenta tiro' en la carota


La ganga de la Glizzy


Los Diablo de LLoren', hijueputa


Esto es Glizzy Gang, Money Wayy


Tú no ere' bichote, cabrón, tú ere' un bobo


Un fuletazo en la cara


El demon


Con el único conejo claro en el infierno


Un fuletazo y volveremo' a verno'


Ando modo diablo, mírame los cuerno'


Las paca', el skimask, la trenza y los dreadlock'


Santurce en la casa, las Glock' te dan welcome


Ando con dos culo' montando en un jetsco


Un poco de molly, las tramas y las perco


Te mato dónde sea, you know I don't play, boy


Chingando putas como el viejo de PlayBoy


Siete carros, eso es un convoy


Con más herramientas que en Pep Boys


Ando en la Mercedes Carota


Sesenta tiro' en la carota


Yo valgo mil kilos de coca


A mí en la calle no me tocan


Tú no ere' bichote, no tienes poder y no mandas en tu canto


Yo ando con la cone planeando la vuelta


En Perú, estoy meti'o en un campo


300 y el AK, salimo' a cazar cabrone'


Vivimo' en Grand Theft Auto


Me dieron la verde después del rutial


La H, yo hablé con los santos


Te estamo' cazando, tu tiempo se está acabando


No respetamo' los rango', los palos en el Hellcat Durango


Sin licencia, pero arma'o caminando


Dime, Bad Bunny, tengo la Glizzy en el rony


El Lambo clavo electrony, el mundo es mío como Tony


Tengo millone' sin firmar con Sony, bitch


¿Que tú ere' bichote? (No, no)


¿Que tú ere' bandido? (No, no)


¿Tú no mata' a nadie? (No, no)


¿Y qué tú ere'? ¿Y qué tú ere'?


¿Tú ere' un sicario? (No, no)


¿Tú ere' millonario? (No, no)


¿Tú manda en tu barrio? (No, no)


¿Y qué tú ere'? ¿Y qué tú ere'?


El diablo', hijueputa, YOVNGCHIMI


Dime, Bad Bunny


Hydreezy


Los Diablo' de LLoren', hijueputa


Esto es Glizzy Gang, Money Wayy (real hasta la Glizzy)


Tú sabe' los sello', cabrón, ¿oíste?",https://www.letras.com//bad-bunny/mercedes-carota-part-yovngchimi/
